"小値賀空港","[小値賀空港〔長崎県北松浦郡小値賀町〕 ※定期便は設定されていない。] 小値賀空港 （おぢかくうこう、 英 ：Ojika Airport）は、 長崎県 北松浦郡 小値賀町 の小値賀島にある 地方管理空港 である。定期便は運航されていない。","https://ja.wikipedia.org/wiki/小値賀空港","日本の空港","https://ja.wikipedia.org/wiki/日本の空港","箇条書き,制限あり","北緯33度11分15秒東経129度05分33秒","長崎県北松浦郡小値賀町前方郷","商業","日本","長崎県","7.7m(25.3ft)","03/21","10:00 - 16:00","小値賀空港","","","","","","","","","","",""
"上五島空港","[上五島空港〔長崎県南松浦郡新上五島町〕 ※定期便は設定されていない。] 上五島空港 （かみごとうくうこう、Kami-Goto Airport）は、 長崎県 南松浦郡 新上五島町 にある 地方管理空港 である。定期便は運航されていない。","https://ja.wikipedia.org/wiki/上五島空港","日本の空港","https://ja.wikipedia.org/wiki/日本の空港","箇条書き,制限あり","北緯33度00分36秒東経129度11分40秒","長崎県南松浦郡新上五島町友住郷744","商業","日本","長崎県","80m(263ft)","17/35","10:00 - 16:00","-","","","","","","","","","","",""
"福江空港","[福江空港（五島つばき空港）〔長崎県五島市〕] 福江空港 （ふくえくうこう Fukue Airport ）は、 長崎県 五島市 にある 地方管理空港 である。愛称は特産品にちなんだ「 五島つばき空港 」。","https://ja.wikipedia.org/wiki/福江空港","日本の空港","https://ja.wikipedia.org/wiki/日本の空港","箇条書き,制限あり","北緯32度40分03秒東経128度50分24秒","長崎県五島市上大津町2158","商業","日本","長崎県","76.6m(251ft)","03/21","8:00 - 19:30","福江空港","","","","","","","","","","",""
"熊本空港","[熊本空港（阿蘇くまもと空港）〔熊本県益城郡益城町〕] 熊本市 から北東へ約20kmの 阿蘇山 の山麓にある。 空港ビル は益城町にあるものの、 滑走路 のほとんどは 菊池郡 菊陽町 にあたる。 空港周辺が霧の多い場所であるため、 ILS カテゴリーIIIb（CATIII-b）で運用しており、（規定以下の横風・機体側の装備・操縦士の保持資格が整えば）自動着陸が可能である。","https://ja.wikipedia.org/wiki/熊本空港","日本の空港","https://ja.wikipedia.org/wiki/日本の空港","箇条書き,制限あり","北緯32度50分14秒東経130度51分18秒","熊本県上益城郡益城町小谷","商業","日本","熊本国際空港","196m(642ft)","07/25","7:30 - 21:30","熊本空港","150ha","","","","","","","","","",""
"天草飛行場","[天草飛行場（天草空港）〔熊本県天草市〕] 天草地方 の行政、商業、交通の中心地である旧 本渡市 の市街地より、約6kmの 天草下島 の北部にある高尾山の山頂付近（旧 天草郡 五和町 と旧本渡市の境）に位置し、主に天草地方の 空運 を担っている  。","https://ja.wikipedia.org/wiki/天草飛行場","日本の空港","https://ja.wikipedia.org/wiki/日本の空港","箇条書き,制限あり","北緯32度28分49秒東経130度09分30秒","熊本県天草市五和町城河原1丁目2080","その他","日本","熊本県","103m(338ft)","13/31","7:40 - 20:30","天草空港","30.6ha","2000年3月23日","62,759人","2.1t","","","","","","",""
"大分空港","[大分空港〔大分県国東市〕] 大分県北東部 国東半島 の沿岸海域を 埋め立て て造成した空港であり、 海上空港 とされることもある   。滑走路は、ほぼ真南北に延び、かつ海上に位置する。","https://ja.wikipedia.org/wiki/大分空港","日本の空港","https://ja.wikipedia.org/wiki/日本の空港","箇条書き,制限あり","北緯33度28分34秒東経131度44分23秒","大分県国東市安岐町下原","商業","日本","国土交通大臣","6m(19ft)","01/19","7:30 - 22:30","大分空港","","","","","","","","","","",""
"大分県央飛行場","[大分県央飛行場（大分県央空港）〔大分県豊後大野市〕 ※定期便は設定されていない。] 大分県央飛行場 （おおいたけんおうひこうじょう）は、 大分県 豊後大野市 大野町田代にある 飛行場 。 大分県央空港 （おおいたけんおうくうこう）とも呼ばれる。","https://ja.wikipedia.org/wiki/大分県央飛行場","日本の空港","https://ja.wikipedia.org/wiki/日本の空港","箇条書き,制限あり","北緯33度01分34秒東経131度30分20秒","大分県豊後大野市","商業","日本","大分県","235m(771ft)","11/29","9:00 - 16:30","","","","","","","","","","1992年（平成4年）4月","",""
"宮崎空港","[宮崎空港（宮崎ブーゲンビリア空港）〔宮崎県宮崎市〕] 宮崎市の南部、 海岸地帯 にある。市の中心部からの距離は約5km。1996年に、 ターミナルビル まで 連絡鉄道 （JR 宮崎空港線 ）が接続された。宮崎市街地とは直接、 宮崎交通 の 路線バス と、 JR九州 の鉄道の両方のアクセスがある。プロ野球 巨人軍 キャンプ地の 宮崎県総合運動公園 のほか、 青島 ・ 飫肥城下町 ・ 日南市 方面や、県西部の 小林市 方面、 都城市 方面へも路線バスがある。 大分市 ・ 佐伯市 ・ 延岡市 ・ 日向市 方面は、 宮崎空港駅 から鉄道でのアクセスのみとなっている。","https://ja.wikipedia.org/wiki/宮崎空港","日本の空港","https://ja.wikipedia.org/wiki/日本の空港","箇条書き,制限あり","北緯31度52分38秒東経131度26分55秒","宮崎県宮崎市大字赤江無番地","商業","日本","国土交通大臣","6m(19ft)","09/27","7:30 - 21:30","https://www.miyazaki-airport.co.jp/","","","","","","","","","","",""
"鹿児島空港","[鹿児島空港〔鹿児島県霧島市〕] 鹿児島市 の北東30kmに位置する。鉄道でのアクセスは悪いが、E3 九州自動車道 溝辺鹿児島空港インターチェンジ に近いため高速道路を経由したアクセスは良好である。 熊本県 南部（ 人吉市 、 球磨郡 各町村、 水俣市 ）や 宮崎県 南西部（ 小林市 や えびの市 ）などの利用者も多い。鹿児島市街地からは空港連絡バス（九州自動車道経由）が日中約10分間隔で運行されており、 鹿児島中央駅 からの所要時間は38分である。","https://ja.wikipedia.org/wiki/鹿児島空港","日本の空港","https://ja.wikipedia.org/wiki/日本の空港","箇条書き,制限あり","北緯31度48分00秒東経130度43分18秒","鹿児島県霧島市溝辺町麓","商業","日本","国土交通大臣","271.9m(892.1ft)","16/34","7:00 - 22:00","鹿児島空港","","","","","","","","","","",""
"薩摩硫黄島飛行場","[薩摩硫黄島飛行場〔鹿児島県鹿児島郡三島村〕] 三島村薩摩硫黄島飛行場 （みしまむらさつまいおうじまひこうじょう）は 鹿児島県 鹿児島郡 三島村 （ 硫黄島 ）にあり、三島村が設置管理者となっている非公共用 飛行場 。","https://ja.wikipedia.org/wiki/薩摩硫黄島飛行場","日本の空港","https://ja.wikipedia.org/wiki/日本の空港","箇条書き,制限あり","北緯30度46分51秒東経130度16分22秒","鹿児島県鹿児島郡三島村硫黄島無番地","共用","日本","三島村","103m(338ft)","18/36","8:30 - 17:00(JST)","","","","","","","","","","","",""
"種子島空港","[種子島空港（コスモポート種子島）〔鹿児島県熊毛郡中種子町〕] 種子島のほぼ中央に位置する。約8km南西に位置した 旧種子島空港 は滑走路が1,500mと短いため プロペラ機 のみの就航であったが、新種子島空港の開港により、同県の離島空港の中で、 徳之島空港 、 奄美空港 に次いで、同港に ジェット機 （小型）の乗り入れが可能になった。","https://ja.wikipedia.org/wiki/種子島空港","日本の空港","https://ja.wikipedia.org/wiki/日本の空港","箇条書き,制限あり","北緯30度36分18秒東経130度59分30秒","鹿児島県熊毛郡中種子町増田2692番地64","商業","日本","鹿児島県","234m(768ft)","13/31","8:30 - 18:30","－","","","86,962人","114.4 t","","","1,835回","","","",""
"屋久島空港","[屋久島空港〔鹿児島県熊毛郡屋久島町〕] 屋久島の東側の海岸に所在する。 滑走路 は1500メートルで、北西から南東へ向いている。 平行誘導路 、 ターニングパッド はなく、 計器着陸装置 も設置されていない。エプロンは小型機対応の2バースである。","https://ja.wikipedia.org/wiki/屋久島空港","日本の空港","https://ja.wikipedia.org/wiki/日本の空港","箇条書き,制限あり","北緯30度23分08秒東経130度39分33秒","鹿児島県熊毛郡屋久島町小瀬田","商業","日本","鹿児島県","37.3m(122.4ft)","14/32","8:30 - 18:30","","","","145,814人","90.55 t","","","2,329回","","","",""
"奄美空港","[奄美空港〔鹿児島県奄美市〕] 奄美大島北東部の、奄美群島国定公園（ 2017年 に 奄美群島国立公園 に指定  ）内の沿岸海域を埋め立てて造成された  。","https://ja.wikipedia.org/wiki/奄美空港","日本の空港","https://ja.wikipedia.org/wiki/日本の空港","箇条書き,制限あり","北緯28度25分51秒東経129度42分45秒","鹿児島県奄美市笠利町","商業","日本","鹿児島県","4.2m(13ft)","03/21","8:00 - 19:30","奄美空港","110ha","1964年6月","884,550人","909.63 t","","","7,931回","","","",""
"喜界空港","[喜界空港〔鹿児島県大島郡喜界町〕] 島の西海岸沿いに設置されており、太平洋戦争中は旧海軍の前線基地として利用された  。","https://ja.wikipedia.org/wiki/喜界空港","日本の空港","https://ja.wikipedia.org/wiki/日本の空港","箇条書き,制限あり","北緯28度19分17秒東経129度55分41秒","鹿児島県大島郡喜界町","商業","日本","鹿児島県","4.7m(15ft)","07/25","","","20.9ha","","86,928人","202.02 t","","","1,839回","","","",""
"徳之島空港","[徳之島空港（徳之島子宝空港）〔鹿児島県大島郡天城町〕] 徳之島北部の西海岸リーフ上に埋め立てて建設された  。","https://ja.wikipedia.org/wiki/徳之島空港","日本の空港","https://ja.wikipedia.org/wiki/日本の空港","箇条書き,制限あり","北緯27度50分11秒東経128度52分53秒","鹿児島県大島郡天城町","商業","日本","鹿児島県","2.3m(7.5ft)","01/19","8:30 - 18:30","","52.6ha","1962年2月23日","202,021人","195.87 t","","","2,705回","","","",""
"沖永良部空港","[沖永良部空港（えらぶゆりの島空港）〔鹿児島県大島郡和泊町〕] 島の最北端にある国頭岬に位置している  。","https://ja.wikipedia.org/wiki/沖永良部空港","日本の空港","https://ja.wikipedia.org/wiki/日本の空港","箇条書き,制限あり","北緯27度25分54秒東経128度42分20秒","鹿児島県大島郡和泊町","商業","日本","鹿児島県","27.8m(91.2ft)","04/22","8:30 - 18:30（4月 - 9月）8:30 - 17:30（10月 - 3月）","","","","115,746人","94.66 t","","","2,154回","","","",""
"与論空港","[与論空港〔鹿児島県大島郡与論町〕] 島西部に位置しており、島の中心である 茶花 集落や 与論港フェリーターミナル も近い。ただし接続する 路線バス 等の交通機関は一切なく、移動には車が必要となる。","https://ja.wikipedia.org/wiki/与論空港","日本の空港","https://ja.wikipedia.org/wiki/日本の空港","箇条書き,制限あり","北緯27度02分38秒東経128度24分06秒","鹿児島県大島郡与論町","商業","日本","鹿児島県","14.4m(47.2ft)","14/32","8:30 - 18:30（4月 - 9月）8:30 - 17:30（10月 - 3月）","","","","75,484人","48 t","","","1,480回","","","",""
"那覇空港","[那覇空港〔那覇市〕] 1933年 （ 昭和 8年）8月、 日本軍 は半農半漁の集落として栄えた旧 小禄村 大嶺（ウフンミ）の土地を強制接収し   、 海軍 の 軍用飛行場 、小禄飛行場（小禄海軍飛行場・海軍小禄飛行場）を建設した。","https://ja.wikipedia.org/wiki/那覇空港","日本の空港","https://ja.wikipedia.org/wiki/日本の空港","箇条書き,制限あり","北緯26度12分20秒東経127度39分03秒","沖縄県那覇市字鏡水","軍民共用","日本","国土交通大臣","3.3m","18L/36R","24時間","那覇空港旅客ターミナルビル","327.8ha","","","","","","","","","",""
"伊江島空港","[伊江島空港〔国頭郡伊江村〕 ※定期便は設定されていない。] 1975年（昭和50年）7月に開催された 沖縄国際海洋博覧会 の関連事業として開港している  。伊江島の中心部あたりに設置されているが、元々は戦前、日本陸軍によって作られた「 伊江島東飛行場 」がベースとなっており、 第二次世界大戦 後の 連合国軍 （ アメリカ軍 ）の施設 占領 と返還を経て、再整備の上で新たにターミナルが建設された。","https://ja.wikipedia.org/wiki/伊江島空港","日本の空港","https://ja.wikipedia.org/wiki/日本の空港","箇条書き,制限あり","北緯26度43分21秒東経127度47分13秒","沖縄県国頭郡伊江村字東江上3992-2","商業","日本","沖縄県","72.5m(237.9ft)","04/22","12:15 - 16:45（土曜日）9:15 - 16:45（日曜日）","-","","","","","","","","","","",""
"慶良間空港","[慶良間空港〔島尻郡座間味村〕 ※定期便は設定されていない。] 慶留間橋の架橋により地続きとなっている 慶良間諸島 の無人島、 外地島 の東側に所在する。固定翼機による定期便は無いが、 エクセル航空 によるチャーターヘリの受け入れや、救急患者移送などの必要性から職員を配置し稼動している。","https://ja.wikipedia.org/wiki/慶良間空港","日本の空港","https://ja.wikipedia.org/wiki/日本の空港","箇条書き,制限あり","北緯26度10分06秒東経127度17分36秒","沖縄県島尻郡座間味村字慶留間934-13","地方管理空港（旧第3種空港）","日本","沖縄県","47.5m(155.8ft)","02/20","8:00 - 18:00","－","","","","","","","","","","",""
"粟国空港","[粟国空港〔島尻郡粟国村〕　※定期便は設定されていない。] 那覇市の北西約60kmに位置する粟国島の中心部から、北東約2kmに所在する。かつては 第一航空 により 那覇空港 との間で不定期運航が行われていたが、 2015年 8月に発生した事故のため運航を休止。 2018年 1月に運航を再開したものの、同年4月から再休止  。第一航空は 4月27日 に沖縄からの事業撤退を表明し、同年6月に沖縄事業所を閉鎖したことから運航再開の目途が立たなくなっていた  。","https://ja.wikipedia.org/wiki/粟国空港","日本の空港","https://ja.wikipedia.org/wiki/日本の空港","箇条書き,制限あり","北緯26度35分34秒東経127度14分25秒","沖縄県島尻郡粟国村字浜4550","商業","日本","沖縄県","11.6m(38.1ft)","01/19","8:00 - 18:00","－","","","","","","","","","","",""
"久米島空港","[久米島空港〔島尻郡久米島町〕] 年間利用客数は、合計257,311人（2019年度）  。沖縄県内では 那覇空港 、 新石垣空港 、 宮古空港 に次いで4番目に多い。","https://ja.wikipedia.org/wiki/久米島空港","日本の空港","https://ja.wikipedia.org/wiki/日本の空港","箇条書き,制限あり","北緯26度21分49秒東経126度42分50秒","沖縄県島尻郡久米島町字北原566-2","商業","日本","沖縄県","6.91m(22.8ft)","03/21","8:00 - 19:30","","","","257,311人","1,499 t","","","2,630回","","","",""
"北大東空港","[北大東空港〔島尻郡北大東村〕] 年間利用客数は、合計23,216人（2019年度）  。","https://ja.wikipedia.org/wiki/北大東空港","日本の空港","https://ja.wikipedia.org/wiki/日本の空港","箇条書き,制限あり","北緯25度56分41秒東経131度19分37秒","沖縄県島尻郡北大東村字南19-16","商業","日本","沖縄県","21.6m(70.9ft)","03/21","8:00 - 18:00","","35.9ha","1978年","23,216人","80.82 t","","","385回","","","",""
"南大東空港","[南大東空港〔島尻郡南大東村〕] 沖縄本島の約400 km東方に位置する南大東島の東側に置かれている。強風時に船が接岸できない自然環境の南大東島において、航空機の就航は重要な役割を担う。年間利用客数は、合計48,766人（2019年度）  。","https://ja.wikipedia.org/wiki/南大東空港","日本の空港","https://ja.wikipedia.org/wiki/日本の空港","箇条書き,制限あり","北緯25度50分48秒東経131度15分49秒","沖縄県島尻郡南大東村字旧東258","商業","日本","沖縄県","48.3m(158.5ft)","02/20","8:00 - 18:00","","","","48,766人","277.3 t","","","758回","","","",""
"宮古空港","[宮古空港〔宮古島市〕] 年間乗降客数は合計1,757,952人（2019年度）  。国内では23番目、沖縄県内では 那覇空港 、 新石垣空港 に次いで3番目に乗降客数が多い空港である。","https://ja.wikipedia.org/wiki/宮古空港","日本の空港","https://ja.wikipedia.org/wiki/日本の空港","箇条書き,制限あり","北緯24度46分58秒東経125度17分42秒","沖縄県宮古島市平良字下里1657番地128","商業","日本","沖縄県","42.8m(140.9ft)","04/22","8:00 - 21:00","宮古空港ターミナルビル","123.9ha","1975年3月","1,757,952人","11,865 t","","","8,354回","","","",""
"下地島空港","[下地島空港〔宮古島市〕] 日本国内での パイロット 養成の需要に応えるための 訓練 飛行場として開設されたが、民営化された  。3,000m×60mの 滑走路 を持ち、航空機の操縦訓練のために、 日本の空港 では数少ない、滑走路両端に 計器着陸装置 （ILS）が設置されている地方空港である  。","https://ja.wikipedia.org/wiki/下地島空港","日本の空港","https://ja.wikipedia.org/wiki/日本の空港","箇条書き,制限あり","北緯24度49分36秒東経125度08分41秒","沖縄県宮古島市伊良部字佐和田1727番地","商業","日本","沖縄県","7.58m(24ft)","17/35","8:00 - 19:30※8:00 - 9:00・16:30 - 19:30は那覇空港からのリモート運用（2019年10月10日から実施）","https://shimojishima.jp/","361.5ha","1979年7月","","","","宮古島","","","","",""
"多良間空港","[多良間空港〔宮古郡多良間村〕] 宮古列島 の南西端にあり、宮古島から西南西約67kmに位置する 多良間島 の西端に所在する。","https://ja.wikipedia.org/wiki/多良間空港","日本の空港","https://ja.wikipedia.org/wiki/日本の空港","箇条書き,制限あり","北緯24度39分14秒東経124度40分31秒","沖縄県宮古郡多良間村","商業","日本","沖縄県","10.3m(33.8ft)","18/36","8:00 - 18:00","","34.9ha","1974年7月","46,330人","248.8 t","","","725回","","","",""
"新石垣空港","[新石垣空港（南ぬ島石垣空港）〔石垣市〕] 元のウィキデータクエリ を参照してください.","https://ja.wikipedia.org/wiki/新石垣空港","日本の空港","https://ja.wikipedia.org/wiki/日本の空港","箇条書き,制限あり","北緯24度23分47秒東経124度14分42秒","沖縄県石垣市字白保1960-104-1","公共","日本","沖縄県","","04/22","8:00 - 21:00(JST)","南ぬ島石垣空港","","","","","","","","","","",""
"波照間空港","[波照間空港〔八重山郡竹富町〕 ※定期便は設定されていない。] 日本最南端の空港である。定期便は運航されていないが、救急患者移送などの必要性から職員を配置し稼動している。","https://ja.wikipedia.org/wiki/波照間空港","日本の空港","https://ja.wikipedia.org/wiki/日本の空港","箇条書き,制限あり","北緯24度03分30秒東経123度48分14秒","沖縄県八重山郡竹富町","商業","日本","沖縄県","13.1m(43ft)","02/20","8:00 - 18:00","","","","","","","","","","","",""
"与那国空港","[与那国空港〔八重山郡与那国町〕] 日本の空港で最西端に位置する。年間利用客数は、合計101,562人（2019年度）  。","https://ja.wikipedia.org/wiki/与那国空港","日本の空港","https://ja.wikipedia.org/wiki/日本の空港","箇条書き,制限あり","北緯24度28分03秒東経122度58分47秒","沖縄県八重山郡与那国町","商業","日本","沖縄県","15m(49.4ft)","08/26","8:00 - 19:30","","58.2ha","","101,562人","444.4 t","","","1,489回","","","",""
"航空自衛隊","[凡例 : 空自 -航空自衛隊、海自 -海上自衛隊、陸自 -陸上自衛隊、海保 -海上保安庁（自衛隊共用のみ）、米空 -アメリカ空軍、米海 -アメリカ海軍、米海兵 -アメリカ海兵隊、米陸 -アメリカ陸軍] 諸外国からは、 Japanese Air Force （日本 空軍 の意）に相当する語で表現されることがある。","https://ja.wikipedia.org/wiki/航空自衛隊","日本の空港","https://ja.wikipedia.org/wiki/日本の空港","箇条書き,制限あり","","〒162-8804東京都新宿区市谷本村町5番1号","","","","","","","","","","","","","","","","","",""
"計根別飛行場","[計根別飛行場（西春別空港）〔北海道別海町・中標津町〕] 計根別飛行場 （けねべつひこうじょう、Kenebetsu Air Base）は、 北海道 野付郡 別海町 にある 航空自衛隊 の管理する 飛行場 である。 陸上自衛隊 別海駐屯地 と一体化している。ここには、航空機やヘリコプターなどの実力部隊は配備されず、有事に備えた 代替滑走路 として運用されている。近くに 矢臼別演習場 があるため、演習時の陸上自衛隊や アメリカ海兵隊 の移動にも使われる。","https://ja.wikipedia.org/wiki/計根別飛行場","日本の空港","https://ja.wikipedia.org/wiki/日本の空港","箇条書き,制限あり","北緯43度25分26秒東経144度44分33秒","","","","","","","","","","","","","","","","","","",""
"帯広市","[十勝飛行場〔北海道帯広市〕帯広駐屯地（陸自）] 帯広市 （おびひろし）は、 北海道 中東部（ 道東地方 ）にある 市 。 十勝総合振興局 の振興局所在地。 計量特定市 。","https://ja.wikipedia.org/wiki/帯広市","日本の空港","https://ja.wikipedia.org/wiki/日本の空港","箇条書き,制限あり","北緯42度55分16.99秒 東経143度11分59.96秒","〒080-8670北海道帯広市西5条南7丁目1番地","","","","","","","","","","","","","","","","","619.34km2","日本"
"帯広駐屯地","[帯広駐屯地（陸自）] 帯広駐屯地 （おびひろちゅうとんち、JGSDF Camp Obihiro）は、 北海道 帯広市 南町南7線31番地に所在し、 第5旅団 等が駐屯している 陸上自衛隊 の 駐屯地 である。","https://ja.wikipedia.org/wiki/帯広駐屯地","日本の空港","https://ja.wikipedia.org/wiki/日本の空港","箇条書き,制限あり","北緯42度53分25秒 東経143度09分30秒","北海道帯広市南町南7線31番地","","","","","","","","","","","","","","","","","260万平方メートル",""
"旭川市","[旭川飛行場〔北海道旭川市〕旭川駐屯地（陸自）] 旭川市 （あさひかわし）は、 北海道 北中部（ 道北地方 ）に位置し、 上川総合振興局 に属する 市 。 上川盆地 に広がる振興局所在地であり、 札幌市 に次ぐ北海道第2位の人口（約33万人）を有する 中核市 である  。","https://ja.wikipedia.org/wiki/旭川市","日本の空港","https://ja.wikipedia.org/wiki/日本の空港","箇条書き,制限あり","北緯43度46分14.3秒東経142度21分54.0秒","〒070-8525北海道旭川市6条通9丁目北緯43度46分14.3秒東経142度21分54.0秒﻿ / ﻿北緯43.770639度 東経142.365000度﻿ /43.770639; 142.365000座標:北緯43度46分14.3秒東経142度21分54.0秒﻿ / ﻿北緯43.770639度 東経142.365000度﻿ /43.770639; 142.365000","","","","","","","","","","","","","","","","","747.66km2","日本"
"旭川駐屯地","[旭川駐屯地（陸自）] 旭川駐屯地 （あさひかわちゅうとんち、JGSDF Camp Asahikawa）は 北海道 旭川市 春光町国有無番地に所在し、 第2師団 司令部等が駐屯している 陸上自衛隊 の 駐屯地 。","https://ja.wikipedia.org/wiki/旭川駐屯地","日本の空港","https://ja.wikipedia.org/wiki/日本の空港","箇条書き,制限あり","北緯43度47分41秒 東経142度21分57秒","北海道旭川市春光町国有無番地","","","","","","","","","","","","","","","","","",""
