"目達原駐屯地","[目達原駐屯地（陸自）] 目達原駐屯地 （めたばるちゅうとんち、JGSDF Camp Metabaru）は、 佐賀県 神埼郡 吉野ヶ里町 大字立野7番地に所在し、 陸上自衛隊九州補給処 等が駐屯する 陸上自衛隊 の 駐屯地 である。","https://ja.wikipedia.org/wiki/目達原駐屯地","日本の空港","https://ja.wikipedia.org/wiki/日本の空港","箇条書き,制限あり","北緯33度19分31秒 東経130度24分49秒","佐賀県神埼郡吉野ヶ里町大字立野7番地","","","","","","","","","","","","","","","","","",""
"大村市","[大村飛行場（旧長崎空港A滑走路地区）〔長崎県大村市〕大村航空基地（海自）] 大村市 （おおむらし）は、 長崎県 の中央に位置する 市 。東は 多良岳 県立公園、西は 大村湾 を望む自然豊かな市である。また、 長崎空港 があることから、長崎県の玄関口としての面も併せ持つ。人口密度は、長崎県で第2位。長崎県で第4位の人口を有する。九州では第32位の人口を有する都市である。","https://ja.wikipedia.org/wiki/大村市","日本の空港","https://ja.wikipedia.org/wiki/日本の空港","箇条書き,制限あり","北緯32度54分0秒 東経129度57分30秒","〒856-8686長崎県大村市玖島一丁目25番地","","","","","","","","","","","","","","","","","126.64km2","日本"
"大村航空基地","[大村航空基地（海自）] かつては「大村空港」と呼ばれていたが、1975年（ 昭和 50年）の海上滑走路の供用と同時に、民間旅客ターミナル等は海上空港である長崎空港に移転。大村空港跡地の名称は「長崎空港A滑走路地区」に変更となった。2011年に長崎空港A滑走路地区は国土交通省から防衛省に移管され、名称は「大村飛行場」となった  。","https://ja.wikipedia.org/wiki/大村航空基地","日本の空港","https://ja.wikipedia.org/wiki/日本の空港","箇条書き,制限あり","北緯32度55分47.65秒東経129度55分56.89秒","長崎県大村市今津町","軍民共用","日本","防衛省","","18/36","","","","1923年","","","","","","","","",""
"児湯郡","[新田原飛行場〔宮崎県児湯郡新富町〕新田原基地（空自）] 児湯郡 （こゆぐん）は、 宮崎県 （ 日向国 ）の 郡 。","https://ja.wikipedia.org/wiki/児湯郡","日本の空港","https://ja.wikipedia.org/wiki/日本の空港","箇条書き,制限あり","","","","","","","","","","","","","","","","","","","",""
"新田原基地","[新田原基地（空自）] 新田原基地 （にゅうたばるきち、Nyutabaru Airbase）は、 宮崎県 児湯郡 新富町 大字新田19581に所在する 航空自衛隊 の基地。 第5航空団 等が配備されている。基地司令は第5航空団司令が兼務。","https://ja.wikipedia.org/wiki/新田原基地","日本の空港","https://ja.wikipedia.org/wiki/日本の空港","箇条書き,制限あり","北緯32度05分01秒東経131度27分05秒","宮崎県児湯郡新富町大字新田19581","軍用","日本","航空自衛隊","79m(259ft)","10/28","","","","","","","防衛省","","","第5航空団","","",""
"鹿屋市","[鹿屋飛行場〔鹿児島県鹿屋市〕鹿屋航空基地（海自）] 鹿屋市 （かのやし）は、 鹿児島県 にある 市 。 九州 南東部、 大隅半島 の中央部に位置する。","https://ja.wikipedia.org/wiki/鹿屋市","日本の空港","https://ja.wikipedia.org/wiki/日本の空港","箇条書き,制限あり","北緯31度22分41.6秒東経130度51分8秒","〒893-8501鹿児島県鹿屋市共栄町20番1号北緯31度22分41.6秒東経130度51分8秒﻿ / ﻿北緯31.378222度 東経130.85222度﻿ /31.378222; 130.85222﻿ (鹿屋市)座標:北緯31度22分41.6秒東経130度51分8秒﻿ / ﻿北緯31.378222度 東経130.85222度﻿ /31.378222; 130.85222﻿ (鹿屋市)","","","","","","","","","","","","","","","","","448.15km2","日本"
"鹿屋航空基地","[鹿屋航空基地（海自）] 戦前から使われている航空基地であり、 神風特別攻撃隊 の出撃基地でもあった。 滑走路 脇には、今でも 零式艦上戦闘機 の掩体壕が残されており、司令部庁舎も戦前に建造されたものが2015年まで使用されていた。なお、特攻基地の規模としては、人員・機体数ともに全国的に有名な 知覧 （ 南九州市 ）を上回る。","https://ja.wikipedia.org/wiki/鹿屋航空基地","日本の空港","https://ja.wikipedia.org/wiki/日本の空港","箇条書き,制限あり","北緯31度22分03秒東経130度50分43秒","鹿児島県鹿屋市西原3丁目11-2","軍用","日本","海上自衛隊","65m(214ft)","08R/26L","","","","","","","防衛省","","","第1航空群","1936年","",""
"嘉手納飛行場","[嘉手納飛行場〔沖縄県中頭郡嘉手納町、沖縄市ほか〕嘉手納基地（米空）] 3,700mの 滑走路 2本を有し、約100機の 軍用機 が常駐する 極東 最大の空軍基地、在日空軍最大の基地である。面積においても、日本最大の空港である 東京国際空港 （羽田空港）の約2倍である。かつては スペースシャトル の緊急着陸地に指定されていた。","https://ja.wikipedia.org/wiki/嘉手納飛行場","日本の空港","https://ja.wikipedia.org/wiki/日本の空港","箇条書き,制限あり","北緯26度21分06秒東経127度46分10秒","沖縄県中頭郡嘉手納町・沖縄市・中頭郡北谷町","軍用飛行場","","アメリカ空軍","44m(144ft)","05L/23R","","http://www.kadena.af.mil","","","","","","","","アメリカ第5空軍第18航空団ほか","1945","",""
"普天間飛行場","[普天間飛行場〔沖縄県宜野湾市〕普天間飛行場（米海兵）] 普天間飛行場（FAC6051）は、 沖縄本島 中部（ 那覇市 の北約10km）、 宜野湾市 中心部に位置する。 普天間 は宜野湾市の地名で、 普天満宮 の 門前町 として古くから栄えた地域である。普天間飛行場は、普天間の南西に隣接する地域（宜野湾市大山二丁目）に所在し、その面積は約4.8km 2 で（宜野湾市 野嵩 ・ 新城 ・ 上原 ・ 中原 ・ 赤道 ・ 大山 ・ 真志喜 ・ 宜野湾 ・ 大謝名 にまたがる）、宜野湾市の面積（19.5km 2 ）の約25%にあたる。普天間飛行場を見渡せる場所として、 嘉数高台公園 や 佐喜眞美術館 などがあり、飛行場の周りに住宅地が密集している状況が見て取れる。","https://ja.wikipedia.org/wiki/普天間飛行場","日本の空港","https://ja.wikipedia.org/wiki/日本の空港","箇条書き,制限あり","北緯26度16分27.39秒東経127度45分23.38秒","沖縄県宜野湾市字大山2丁目45","軍用","日本"," 第3海兵遠征軍 国連軍","95m(312ft)","06/24","","普天間基地","","","",""," アメリカ海兵隊","",""," 第1海兵航空団","1945年","",""
"紋別空港","[(旧)紋別空港〔北海道紋別市〕 -1999年11月11日廃港] 紋別空港 （もんべつくうこう、Monbetsu Airport）は、 北海道 紋別市 にある 地方管理空港（旧: 第三種空港） である。愛称は オホーツク紋別空港 （オホーツクもんべつくうこう Okhotsk-Monbetsu Airport ）。","https://ja.wikipedia.org/wiki/紋別空港#旧空港","日本の空港","https://ja.wikipedia.org/wiki/日本の空港","箇条書き,制限あり","北緯44度18分15秒東経143度24分29秒","北海道紋別市","商業","日本","北海道","17.8m(58.4ft)","14/32","9:00 - 17:00 (JST)","","","","","","","","","","","",""
"女満別空港","[(旧)女満別空港〔北海道女満別町（現・大空町）〕 -1985年4月廃港] オホーツク海 沿岸の 網走市 中心部から南西に約22km（バスで約30分）に位置する オホーツク総合振興局 の主要空港である。近傍には網走市と 北見市 を結ぶ 国道39号 が走る。空港周辺地域には 知床国立公園 、 阿寒摩周国立公園 や 網走国定公園 などが存在する。空港が位置する 女満別町 は2006年に 東藻琴村 と合併して 大空町 となったが、空港の名称は変更されなかった。","https://ja.wikipedia.org/wiki/女満別空港#旧空港","日本の空港","https://ja.wikipedia.org/wiki/日本の空港","箇条書き,制限あり","北緯43度52分50秒東経144度09分51秒","北海道網走郡大空町女満別中央","商用","日本","北海道エアポート","33.1m(108ft)","18/36","8:00 - 21:00","女満別空港","166.7ha","","736,169人","1,880t","","","","","","",""
"秋田空港","[(旧)秋田空港〔秋田県秋田市〕 -1981年6月25日廃港] 1981年 （昭和56年）6月26日に開港  。秋田市中心部から南東に約20kmの 河辺郡 雄和町 （現・秋田市）の 雄物川 と 岩見川 に挟まれた 安養寺川 上流の 丘陵地  に位置する。 東北地方 では最も早く2,500m 滑走路 を整備した空港であった。","https://ja.wikipedia.org/wiki/秋田空港#旧空港","日本の空港","https://ja.wikipedia.org/wiki/日本の空港","箇条書き,制限あり","北緯39度36分56秒東経140度13分07秒","秋田県秋田市雄和椿川","商業","日本","秋田県","93.1m(305ft)","10/28","7:00 - 22:00","秋田空港","159ha","1981年6月26日","1,228,136人","2,009t","","","","","","",""
"広島西飛行場","[(旧)広島空港〔広島県広島市西区〕-1993年に広島西飛行場に改称後、2012年11月15日廃港。同日より広島ヘリポートとして供用開始] 広島西飛行場 （ひろしまにしひこうじょう、 Hiroshima-Nishi Airport ）は、 広島県 広島市 西区 観音新町 にかつて存在した 飛行場 である。 1993年 の 広島空港 開港まではこの飛行場が広島空港を名乗った。","https://ja.wikipedia.org/wiki/広島西飛行場","日本の空港","https://ja.wikipedia.org/wiki/日本の空港","箇条書き,制限あり","北緯34度22分17秒東経132度25分04秒","広島県広島市","公共ヘリポート","日本","広島県","3m(9ft)","04/22","","広島ヘリポート","","","","","","","","","","",""
"高松空港","[(旧)高松空港〔香川県高松市〕 -1989年12月15日廃港、「林の飛行場」と呼ばれていた] 高松市の中心部から南へ約15kmの香南台地に、 1989年 12月 開港  （ #空港移転の経緯 を参照）。標高185mの高台にあるため、 霧 が発生しやすく  、霧による視界不良を原因とした到着便の出発地への引き返しや降着地の変更、およびそれに伴う折り返し便の欠航が年に数回起きる  。","https://ja.wikipedia.org/wiki/高松空港#旧空港","日本の空港","https://ja.wikipedia.org/wiki/日本の空港","箇条書き,制限あり","北緯34度12分51秒東経134度00分56秒","香川県高松市","商業","日本","高松空港株式会社","185m(607ft)","08/26","7:00 - 22:00","高松空港","153.9ha","","1,761,608人","11.6t","","","","","","",""
"北九州空港 (初代)","[(旧)北九州空港〔福岡県北九州市〕 -2006年3月15日廃港] 2006年3月15日まで運用されていた 北九州空港 （きたきゅうしゅうくうこう）は、 福岡県 北九州市 小倉南区 大字 曽根 に位置し、 国土交通大臣 が設置管理していた 日本の空港 である。 新北九州空港 の開港に伴い運用を終了し、跡地は北九州空港跡地産業団地として整備されている。","https://ja.wikipedia.org/wiki/北九州空港_(初代)","日本の空港","https://ja.wikipedia.org/wiki/日本の空港","箇条書き,制限あり","北緯33度50分11秒東経130度56分49秒","福岡県北九州市小倉南区大字曽根","民間","日本","","3m(10ft)","11/29","","","","1944年","","","","","","","","",""
"熊本空港","[(旧)熊本空港〔熊本県熊本市〕 - 1971年4月廃港] 熊本市 から北東へ約20kmの 阿蘇山 の山麓にある。 空港ビル は益城町にあるものの、 滑走路 のほとんどは 菊池郡 菊陽町 にあたる。 空港周辺が霧の多い場所であるため、 ILS カテゴリーIIIb（CATIII-b）で運用しており、（規定以下の横風・機体側の装備・操縦士の保持資格が整えば）自動着陸が可能である。","https://ja.wikipedia.org/wiki/熊本空港#旧熊本空港（健軍空港）について","日本の空港","https://ja.wikipedia.org/wiki/日本の空港","箇条書き,制限あり","北緯32度50分14秒東経130度51分18秒","熊本県上益城郡益城町小谷","商業","日本","熊本国際空港","196m(642ft)","07/25","7:30 - 21:30","熊本空港","150ha","","","","","","","","","",""
"大分空港","[(旧)大分空港〔大分県大分市〕 -1971年10月廃港] 大分県北東部 国東半島 の沿岸海域を 埋め立て て造成した空港であり、 海上空港 とされることもある   。滑走路は、ほぼ真南北に延び、かつ海上に位置する。","https://ja.wikipedia.org/wiki/大分空港#旧大分空港","日本の空港","https://ja.wikipedia.org/wiki/日本の空港","箇条書き,制限あり","北緯33度28分34秒東経131度44分23秒","大分県国東市安岐町下原","商業","日本","国土交通大臣","6m(19ft)","01/19","7:30 - 22:30","大分空港","","","","","","","","","","",""
"鹿児島空港","[(旧)鹿児島空港〔鹿児島県鹿児島市〕 - 1972年4月廃港] 鹿児島市 の北東30kmに位置する。鉄道でのアクセスは悪いが、E3 九州自動車道 溝辺鹿児島空港インターチェンジ に近いため高速道路を経由したアクセスは良好である。 熊本県 南部（ 人吉市 、 球磨郡 各町村、 水俣市 ）や 宮崎県 南西部（ 小林市 や えびの市 ）などの利用者も多い。鹿児島市街地からは空港連絡バス（九州自動車道経由）が日中約10分間隔で運行されており、 鹿児島中央駅 からの所要時間は38分である。","https://ja.wikipedia.org/wiki/鹿児島空港#鹿児島市鴨池時代の鹿児島空港","日本の空港","https://ja.wikipedia.org/wiki/日本の空港","箇条書き,制限あり","北緯31度48分00秒東経130度43分18秒","鹿児島県霧島市溝辺町麓","商業","日本","国土交通大臣","271.9m(892.1ft)","16/34","7:00 - 22:00","鹿児島空港","","","","","","","","","","",""
"種子島空港 (初代)","[(旧)種子島空港〔鹿児島県中種子町〕 - 2006年3月15日廃港] 種子島空港 （たねがしまくうこう）は 鹿児島県 熊毛郡 中種子町 （ 種子島 ）に存在した 第三種空港 である。 2006年 3月16日に廃止された。","https://ja.wikipedia.org/wiki/種子島空港_(初代)","日本の空港","https://ja.wikipedia.org/wiki/日本の空港","箇条書き,制限あり","北緯30度32分38秒東経130度57分17秒","鹿児島県種子島","第三種空港","日本","","","13/31","","","","1962年7月27日","","","","","","","","",""
"奄美空港","[(旧)奄美空港〔鹿児島県奄美市〕 - 1988年7月9日廃港] 奄美大島北東部の、奄美群島国定公園（ 2017年 に 奄美群島国立公園 に指定  ）内の沿岸海域を埋め立てて造成された  。","https://ja.wikipedia.org/wiki/奄美空港#旧空港","日本の空港","https://ja.wikipedia.org/wiki/日本の空港","箇条書き,制限あり","北緯28度25分51秒東経129度42分45秒","鹿児島県奄美市笠利町","商業","日本","鹿児島県","4.2m(13ft)","03/21","8:00 - 19:30","奄美空港","110ha","1964年6月","884,550人","909.63 t","","","7,931回","","","",""
"南大東空港","[(旧)南大東空港〔沖縄県南大東村〕 - 1997年7月廃港] 沖縄本島の約400 km東方に位置する南大東島の東側に置かれている。強風時に船が接岸できない自然環境の南大東島において、航空機の就航は重要な役割を担う。年間利用客数は、合計48,766人（2019年度）  。","https://ja.wikipedia.org/wiki/南大東空港#旧空港","日本の空港","https://ja.wikipedia.org/wiki/日本の空港","箇条書き,制限あり","北緯25度50分48秒東経131度15分49秒","沖縄県島尻郡南大東村字旧東258","商業","日本","沖縄県","48.3m(158.5ft)","02/20","8:00 - 18:00","","","","48,766人","277.3 t","","","758回","","","",""
"多良間空港","[(旧)多良間空港〔沖縄県多良間村〕 - 2004年7月廃港] 宮古列島 の南西端にあり、宮古島から西南西約67kmに位置する 多良間島 の西端に所在する。","https://ja.wikipedia.org/wiki/多良間空港#旧・空港概要","日本の空港","https://ja.wikipedia.org/wiki/日本の空港","箇条書き,制限あり","北緯24度39分14秒東経124度40分31秒","沖縄県宮古郡多良間村","商業","日本","沖縄県","10.3m(33.8ft)","18/36","8:00 - 18:00","","34.9ha","1974年7月","46,330人","248.8 t","","","725回","","","",""
"石垣空港","[(旧)石垣空港〔沖縄県石垣市〕 -2013年3月6日廃港] 石垣空港 （いしがきくうこう、 Ishigaki Airport ）は、かつて 沖縄県 石垣市 （ 石垣島 ）にあった 地方管理空港 である。年間利用客数は、国内1,674,455人、海外12,046人（2012年度）  。 海上保安庁 第十一管区海上保安本部 石垣航空基地が併設されていた。","https://ja.wikipedia.org/wiki/石垣空港","日本の空港","https://ja.wikipedia.org/wiki/日本の空港","箇条書き,制限あり","北緯24度20分41秒東経124度11分13秒","沖縄県石垣市字真栄里","商業","日本","沖縄県","26.2m(86ft)","04/22","","","","","","","","","","","","",""
"根室市","[牧の内飛行場〔北海道根室市〕] 根室市 （ねむろし）は、 北海道 東部（ 道東地方 ）にある 市 。 根室振興局 の振興局所在地。また、 北海道本島 の最東端にあたる 市 である。その位置から日本の自治体では 日の出 の時間が一番早く、 日没 の時間も一番早い。","https://ja.wikipedia.org/wiki/根室市","日本の空港","https://ja.wikipedia.org/wiki/日本の空港","箇条書き,制限あり","北緯43度19分48秒東経145度34分59秒","〒087-8711北海道根室市常盤町2丁目27北緯43度19分48秒東経145度34分59秒﻿ / ﻿北緯43.33000度 東経145.58306度﻿ /43.33000; 145.58306座標:北緯43度19分48秒東経145度34分59秒﻿ / ﻿北緯43.33000度 東経145.58306度﻿ /43.33000; 145.58306","","","","","","","","","","","","","","","","","506.25km2","日本"
"愛国飛行場 (釧路市)","[愛国飛行場〔北海道釧路町〕] 愛国飛行場 （あいこくひこうじょう）とは、 釧路市 愛国 （同飛行場廃港に因み命名された地域名）に存在した飛行場。700m×600mの転圧滑走路面を持ち、格納庫を1棟備えていた。総面積50 ヘクタール  。 愛国郵便切手寄付金 を活用し、寄付建設された事により、命名された  。","https://ja.wikipedia.org/wiki/愛国飛行場_(釧路市)","日本の空港","https://ja.wikipedia.org/wiki/日本の空港","箇条書き,制限あり","","","","","","","","","","","","","","","","","","","",""
"弟子屈飛行場","[弟子屈飛行場〔北海道弟子屈町〕 -2009年9月24日廃止] 弟子屈飛行場 （てしかがひこうじょう）は 北海道 川上郡 弟子屈町 にあった 飛行場 。全国で唯一の町営飛行場であった。","https://ja.wikipedia.org/wiki/弟子屈飛行場","日本の空港","https://ja.wikipedia.org/wiki/日本の空港","箇条書き,制限あり","北緯43度28分45秒東経144度26分09秒","北海道川上郡弟子屈町美里3丁目","その他飛行場","日本","弟子屈町","110.5m","07/25","8:00-17:00 (JST)","","","","","","","","","","","",""
"阿見飛行場","[阿見飛行場〔茨城県阿見町〕 -2015年2月5日廃止] 阿見飛行場 （あみひこうじょう）は、 茨城県 稲敷郡 阿見町 にかつて存在した非公共用 飛行場  。 設置管理者は 小学館不動産株式会社  、運営はそのグループ企業である 東京航空 株式会社が行っていた。総面積は104,000 m 2 で、滑走路の長さは600 m 、幅員は25mであった  。","https://ja.wikipedia.org/wiki/阿見飛行場","日本の空港","https://ja.wikipedia.org/wiki/日本の空港","箇条書き,制限あり","北緯36度01分26秒東経140度16分00秒","茨城県稲敷郡阿見町島津3440","非公共用","日本","東京航空","20.05m","09/27","9:00 - 17:00（日の出から日没まで）","","","1980年（昭和55年）","","","","","","","","",""
"大西飛行場","[大西飛行場〔群馬県館林市、邑楽町〕 -2004年3月31日廃止] 大西飛行場 （おおにしひこうじょう）は、かつて 群馬県 の 館林市 ・ 邑楽郡 邑楽町 の境界線上にあった 飛行場 。管理者は 大西勇一 で、全国でも珍しい個人が建設した非公共用飛行場であった。","https://ja.wikipedia.org/wiki/大西飛行場","日本の空港","https://ja.wikipedia.org/wiki/日本の空港","箇条書き,制限あり","北緯36度13分57.3秒 東経139度29分36.0秒","","","","","","","","","","","","","","","","","","",""
"藤沢飛行場","[東洋航空藤沢飛行場〔神奈川県藤沢市〕 -1964年10月31日廃止] 藤沢飛行場 （ふじさわひこうじょう）とは 神奈川県 藤沢市 に存在した 飛行場 。 1953年 （ 昭和 28年）- 1964年 （昭和39年）の正式名称は 東洋航空藤沢飛行場 。","https://ja.wikipedia.org/wiki/藤沢飛行場","日本の空港","https://ja.wikipedia.org/wiki/日本の空港","箇条書き,制限あり","北緯35度21分24秒東経139度27分50秒","神奈川県藤沢市藤沢市本藤沢-地理院地図藤沢飛行場跡地（荏原製作所藤沢事業所）-Google マップ","非公共用","日本","東洋航空工業株式会社","","01/19","","","","","","","","","","","","",""
"八日市飛行場","[八日市飛行場〔滋賀県東近江市〕 - 日本初の民間飛行場] 八日市飛行場 (ようかいちひこうじょう)は、かつて 滋賀県 神崎郡 八日市町 沖野ヶ原 (現・ 東近江市 沖野)にあった 大日本帝国陸軍 の 軍用飛行場 である。前身は民間飛行場であり、民間飛行場発祥の地でもあった  。","https://ja.wikipedia.org/wiki/八日市飛行場","日本の空港","https://ja.wikipedia.org/wiki/日本の空港","箇条書き,制限あり","北緯35度06分07秒東経136度12分43秒","滋賀県神崎郡八日市町沖野ヶ原(現・滋賀県東近江市)","軍用","日本","大日本帝国陸軍","","","","","","","","","大日本帝国","","","航空第3大隊→飛行第3連隊","1915年","",""
"木津川飛行場","[木津川飛行場（大阪府大阪市） - 逓信省航空局が開設した最初の飛行場] 木津川飛行場 （きづがわひこうじょう）は 大阪府 大阪市 大正区 にあった飛行場。 大阪飛行場 とも呼ばれた。","https://ja.wikipedia.org/wiki/木津川飛行場","日本の空港","https://ja.wikipedia.org/wiki/日本の空港","箇条書き,制限あり","","","","","","","","","","","","","","","","","","","",""
"鳴尾飛行場","[鳴尾飛行場〔兵庫県西宮市〕] 鳴尾飛行場 （なるおひこうじょう）は、かつて 兵庫県 武庫郡 鳴尾村 （のちの 西宮市 枝川町）に存在していた 大日本帝国海軍 の 飛行場 である。また 川西航空機 （現・ 新明和工業 ）が製造する 軍用機 の試験飛行用も兼ねていた。","https://ja.wikipedia.org/wiki/鳴尾飛行場","日本の空港","https://ja.wikipedia.org/wiki/日本の空港","箇条書き,制限あり","","","","","","","","","","","","","","","","","","","",""
"鶉野飛行場","[鶉野飛行場〔兵庫県〕] 鶉野飛行場 （うずらのひこうじょう）は、 兵庫県 加西市 鶉野町（稼働当時は 加西郡 九会村 ・ 下里村 ）にかつて存在していた 飛行場 である。かつては 防衛省 が管理していたが、 2016年 （ 平成 28年）6月に加西市に払い下げられた  。","https://ja.wikipedia.org/wiki/鶉野飛行場","日本の空港","https://ja.wikipedia.org/wiki/日本の空港","箇条書き,制限あり","","","","","","","","","","","","","","","","","","","",""
"福岡第一飛行場","[福岡第一飛行場（雁ノ巣飛行場）〔福岡県福岡市〕] 福岡第一飛行場 （ふくおかだいいちひこうじょう）はかつて 逓信省 航空局が 福岡県 糟屋郡 和白村 （現在の 福岡市 東区 ） 雁ノ巣 に設置した 飛行場 。 通称 ・ 雁ノ巣飛行場 （がんのすひこうじょう）。 大日本航空 によって 朝鮮 、 台湾 、 中華民国 、 東南アジア への路線が運航され、戦前における国内最大規模の民間飛行場であった。","https://ja.wikipedia.org/wiki/福岡第一飛行場","日本の空港","https://ja.wikipedia.org/wiki/日本の空港","箇条書き,制限あり","北緯33度40分41.5秒東経130度23分52.5秒","福岡県糟屋郡和白村","商業","日本","","","","","","","","","","","","","","","",""
