"広島広域公園陸上競技場","[エディオンスタジアム広島（広島広域公園陸上競技場）/ Eスタ -サンフレッチェ広島] 広島広域公園陸上競技場 （ひろしまこういきこうえんりくじょうきょうぎじょう）は、 広島県 広島市 安佐南区 の 広島広域公園 内にある多目的スタジアム。愛称は 広島ビッグアーチ （ひろしまビッグアーチ）。略称は「広島広」ないしは「広島ビ」  。施設は広島市が所有し、 公益財団法人 広島市スポーツ協会が 指定管理者 として運営管理を行っている。","https://ja.wikipedia.org/wiki/広島広域公園陸上競技場","日本のサッカー競技場一覧","https://ja.wikipedia.org/wiki/日本のサッカー競技場一覧","箇条書き,制限あり","北緯34度26分27.1秒東経132度23分39.3秒","広島県広島市安佐南区大塚西5","広島市","北緯34度26分27.1秒東経132度23分39.3秒﻿ / ﻿北緯34.440861度 東経132.394250度﻿ /34.440861; 132.394250座標:北緯34度26分27.1秒東経132度23分39.3秒﻿ / ﻿北緯34.440861度 東経132.394250度﻿ /34.440861; 132.394250","広島市スポーツ協会","天然芝（107m×73.3m）","1992年9月","あり","","105m×68m","東畑建築事務所","大林組・増岡組他","1998年（芝、諸施設）","","","","","","",""
"維新百年記念公園陸上競技場","[維新みらいふスタジアム（維新百年記念公園陸上競技場）/ みらスタ -レノファ山口FC] なお、福岡県久留米市に本社を置く建築資材販売会社の「みらいふ」が 命名権 を取得しており、2018年1月12日から「 維新みらいふスタジアム 」（いしんみらいふスタジアム、略称「みらスタ」）の呼称を用いている（ 後述 ）。","https://ja.wikipedia.org/wiki/維新百年記念公園陸上競技場","日本のサッカー競技場一覧","https://ja.wikipedia.org/wiki/日本のサッカー競技場一覧","箇条書き,制限あり","北緯34度9分16.1秒東経131度26分14.7秒","山口県山口市維新公園4-1-1","山口県","北緯34度9分16.1秒東経131度26分14.7秒﻿ / ﻿北緯34.154472度 東経131.437417度﻿ /34.154472; 131.437417座標:北緯34度9分16.1秒東経131度26分14.7秒﻿ / ﻿北緯34.154472度 東経131.437417度﻿ /34.154472; 131.437417","一般財団法人山口県施設管理財団","天然芝","1963年（昭和38年）5月","あり","鉄塔4基・1500ルクス","107m×71m","山口県建築指導課佐藤総合計画","鴻池組・井森工業・山口建設特定JV","","約81.5億円","","2007年（平成19年） -2011年（平成23年）","","","",""
"徳島県鳴門総合運動公園陸上競技場","[鳴門・大塚スポーツパークポカリスエットスタジアム（徳島県鳴門総合運動公園陸上競技場）/ 鳴門大塚 -徳島ヴォルティス] 徳島県鳴門総合運動公園陸上競技場 （とくしまけん なるとそうごううんどうこうえん りくじょうきょうぎじょう）は、 徳島県 鳴門市 撫養町立岩 の 徳島県鳴門総合運動公園 （鳴門・大塚スポーツパーク）内にある 陸上競技場 。 球技場 としても使用される。施設は徳島県が所有し、一般財団法人徳島県スポーツ振興財団が 指定管理者 として管理・運営を行っている。","https://ja.wikipedia.org/wiki/徳島県鳴門総合運動公園陸上競技場","日本のサッカー競技場一覧","https://ja.wikipedia.org/wiki/日本のサッカー競技場一覧","箇条書き,制限あり","北緯34度10分04秒東経134度37分04秒","徳島県鳴門市撫養町立岩字四枚61","徳島県","北緯34度10分04秒東経134度37分04秒﻿ / ﻿北緯34.167855度 東経134.617857度﻿ /34.167855; 134.617857","一般財団法人徳島県スポーツ振興財団","天然芝","1971年5月","オーロラビジョン","4基","","","","","","","2001年、2004年、2012年、2014年","","","",""
"香川県立丸亀競技場","[Pikaraスタジアム（香川県立丸亀競技場）/ ピカスタ -カマタマーレ讃岐] 丸亀市総合運動公園は丸亀市営の 運動公園 であるが、本施設のみ県営施設である（本施設以外の施設群は「丸亀市スポーツセンター」と称される）。","https://ja.wikipedia.org/wiki/香川県立丸亀競技場","日本のサッカー競技場一覧","https://ja.wikipedia.org/wiki/日本のサッカー競技場一覧","箇条書き,制限あり","北緯34度15分41.86秒東経133度47分9.29秒","香川県丸亀市金倉町830","香川県","北緯34度15分41.86秒東経133度47分9.29秒﻿ / ﻿北緯34.2616278度 東経133.7859139度﻿ /34.2616278; 133.7859139座標:北緯34度15分41.86秒東経133度47分9.29秒﻿ / ﻿北緯34.2616278度 東経133.7859139度﻿ /34.2616278; 133.7859139","四電工グループ","天然芝（106 m × 69.5 m）","1997年10月10日","オーロラビジョン1基","","105 m × 68 m","日本技術開発浪速設計","大成建設・間組JV中電工・三和建設JV川崎・後藤建設JVパナソニック電工富士通機電","","約86億円","1995年","","","","",""
"愛媛県総合運動公園陸上競技場","[ニンジニアスタジアム（愛媛県総合運動公園陸上競技場）/ ニンスタ -愛媛FC] 愛媛県総合運動公園陸上競技場 （えひめけんそうごううんどうこうえん りくじょうきょうぎじょう）は、 愛媛県 松山市 の 愛媛県総合運動公園 にある 陸上競技場 である。愛媛県が所有し、公益財団法人愛媛県スポーツ振興事業団が 指定管理者 として運営管理を行っている。","https://ja.wikipedia.org/wiki/愛媛県総合運動公園陸上競技場","日本のサッカー競技場一覧","https://ja.wikipedia.org/wiki/日本のサッカー競技場一覧","箇条書き,制限あり","北緯33度46分5.44秒東経132度47分51.34秒","愛媛県松山市上野町乙46番地","愛媛県","北緯33度46分5.44秒東経132度47分51.34秒﻿ / ﻿北緯33.7681778度 東経132.7975944度﻿ /33.7681778; 132.7975944座標:北緯33度46分5.44秒東経132度47分51.34秒﻿ / ﻿北緯33.7681778度 東経132.7975944度﻿ /33.7681778; 132.7975944","公益財団法人愛媛県スポーツ振興事業団","天然芝","1979年10月","あり（2013年設置）","4基（1994年設置）","106m×69.5m","","","2016年3月","","","","","","",""
"長崎県立総合運動公園陸上競技場","[トランスコスモススタジアム長崎（長崎県立総合運動公園陸上競技場）/ トラスタ -V・ファーレン長崎] 長崎県立総合運動公園陸上競技場 （ながさきけんりつ そうごううんどうこうえん りくじょうきょうぎじょう）は、 長崎県 諫早市 の 長崎県立総合運動公園 にある 陸上競技場 。 球技場 としても使用される。施設は長崎県が所有し、一般社団法人長崎県公園緑地協会が 指定管理者 として運営管理を行っている。","https://ja.wikipedia.org/wiki/長崎県立総合運動公園陸上競技場","日本のサッカー競技場一覧","https://ja.wikipedia.org/wiki/日本のサッカー競技場一覧","箇条書き,制限あり","北緯32度50分18.95秒東経130度2分22.3秒","長崎県諫早市宇都町27-1","長崎県","北緯32度50分18.95秒東経130度2分22.3秒﻿ / ﻿北緯32.8385972度 東経130.039528度﻿ /32.8385972; 130.039528座標:北緯32度50分18.95秒東経130度2分22.3秒﻿ / ﻿北緯32.8385972度 東経130.039528度﻿ /32.8385972; 130.039528","一般社団法人長崎県公園緑地協会","天然芝","1969年（2011年に一時取り壊し）","オーロラビジョン1基","","","日本設計","（建設）清水・西海・長崎土建JV、大林・谷川・野副JV（電気）松田・三恵・脇JV、イナヅマ・長営・一電設JV（空調）山口組・岩崎断熱・長翔設備JV（衛生）旭管・大東・長与管工JV（浄化槽）三信設備（通信情報）大菱・共栄・みずほJV","2011年3月 - 2013年6月","約78億円","","2013年3月3日","","","",""
"熊本県民総合運動公園陸上競技場","[えがお健康スタジアム（熊本県民総合運動公園陸上競技場）/ えがおS -ロアッソ熊本] 熊本県民総合運動公園陸上競技場 （くまもとけんみんそうごううんどうこうえん・りくじょうきょうぎじょう）は、 熊本県 熊本市 東区 平山町の 熊本県民総合運動公園 内にある 陸上競技場 。 球技場 としても使用される。熊本県が所有し、熊本県スポーツ振興事業団が 指定管理者 として運営管理を行っている。","https://ja.wikipedia.org/wiki/熊本県民総合運動公園陸上競技場","日本のサッカー競技場一覧","https://ja.wikipedia.org/wiki/日本のサッカー競技場一覧","箇条書き,制限あり","北緯32度50分12.82秒東経130度48分0.52秒","熊本県熊本市東区平山町2776","熊本県","北緯32度50分12.82秒東経130度48分0.52秒﻿ / ﻿北緯32.8368944度 東経130.8001444度﻿ /32.8368944; 130.8001444座標:北緯32度50分12.82秒東経130度48分0.52秒﻿ / ﻿北緯32.8368944度 東経130.8001444度﻿ /32.8368944; 130.8001444","（財）熊本県スポーツ振興事業団","天然芝（107m×70m）","1998年3月","2基","4基","105m×68m","日建設計","鹿島建設、日本国土開発・岩永組工事共同企業体","","","","","","","",""
"大分スポーツ公園総合競技場","[昭和電工ドーム大分（大分スポーツ公園総合競技場）/ 昭和電ド -大分トリニータ] 愛称は一般公募によって決まった「 ビッグアイ 」である。 2019年 3月より 東京都 に本社を置き、大分県内で 大分コンビナート を操業する 化学工業 会社の 昭和電工 が命名権を取得し、「 昭和電工ドーム大分 」（しょうわでんこうドームおおいた、 英語 : SHOWA DENKO DOME OITA 、略称: 昭和電ド）の呼称を使用している（ 後述 ）。","https://ja.wikipedia.org/wiki/大分スポーツ公園総合競技場","日本のサッカー競技場一覧","https://ja.wikipedia.org/wiki/日本のサッカー競技場一覧","箇条書き,制限あり","北緯33度12分3.2秒東経131度39分30.19秒","大分県大分市大字横尾1351番地","大分県","北緯33度12分3.2秒東経131度39分30.19秒﻿ / ﻿北緯33.200889度 東経131.6583861度﻿ /33.200889; 131.6583861座標:北緯33度12分3.2秒東経131度39分30.19秒﻿ / ﻿北緯33.200889度 東経131.6583861度﻿ /33.200889; 131.6583861","株式会社大宣","天然芝（107m × 71m）","2001年3月","1基","1,500ルクス","105m × 68m","KTグループJV(黒川紀章建築都市設計事務所・竹中工務店・さとうベネック・高山総合工業)","KTグループJV(竹中工務店・さとうベネック・高山総合工業)","","251億円","1998年4月","","","","",""
"鹿児島県立鴨池陸上競技場","[白波スタジアム（鹿児島県立鴨池陸上競技場）/ 白波スタ -鹿児島ユナイテッドFC] 鹿児島県立鴨池陸上競技場 （かごしまけんりつ かもいけりくじょうきょうぎじょう）は、 鹿児島県 鹿児島市 の鴨池公園内にある 陸上競技場 。 球技場 としても使用される。 鹿児島県教育庁 所管の「鹿児島県総合体育センター」施設の一つ  で、 セイカスポーツグループ が 指定管理者 として運営管理を行っている。","https://ja.wikipedia.org/wiki/鹿児島県立鴨池陸上競技場","日本のサッカー競技場一覧","https://ja.wikipedia.org/wiki/日本のサッカー競技場一覧","箇条書き,制限あり","北緯31度33分53.39秒東経130度33分36.67秒","鹿児島県鹿児島市与次郎2-2-2","鹿児島県","北緯31度33分53.39秒東経130度33分36.67秒﻿ / ﻿北緯31.5648306度 東経130.5601861度﻿ /31.5648306; 130.5601861座標:北緯31度33分53.39秒東経130度33分36.67秒﻿ / ﻿北緯31.5648306度 東経130.5601861度﻿ /31.5648306; 130.5601861","セイカスポーツグループ","","1970年12月","あり","4基","","","","2014年・2017-2018年","約43億円（改修事業費）","","1995年","","","",""
"沖縄県総合運動公園陸上競技場","[タピック県総ひやごんスタジアム（沖縄県総合運動公園陸上競技場）/ タピック -FC琉球] 沖縄県総合運動公園陸上競技場 （おきなわけんそうごううんどうこうえんりくじょうきょうぎじょう）は、 沖縄県 沖縄市 の 沖縄県総合運動公園 内にある 陸上競技場 。 球技場 としても使用される。施設は 沖縄県 が所有し、株式会社トラステックと 美津濃株式会社 の 共同企業体 が 指定管理者 として運営管理を行っている。","https://ja.wikipedia.org/wiki/沖縄県総合運動公園陸上競技場","日本のサッカー競技場一覧","https://ja.wikipedia.org/wiki/日本のサッカー競技場一覧","箇条書き,制限あり","北緯26度18分30.66秒東経127度49分30.66秒","沖縄県沖縄市比屋根5-3-1","沖縄県","北緯26度18分30.66秒東経127度49分30.66秒﻿ / ﻿北緯26.3085167度 東経127.8251833度﻿ /26.3085167; 127.8251833座標:北緯26度18分30.66秒東経127度49分30.66秒﻿ / ﻿北緯26.3085167度 東経127.8251833度﻿ /26.3085167; 127.8251833","株式会社トラステック・ミズノ共同企業体","天然芝","1987年3月","あり","LED照明塔4基","105m × 68m","久米設計・具志堅建築設計事務所・エスジーエンジニアリング共同企業体（改修時）","","2015年2月","35億円（改修時）","","","","","",""
"Jヴィレッジ","[Jヴィレッジスタジアム/ Jヴィレ] 東京電力 が原子力発電所立地地域の地域振興事業の一つとして総工費130億円を投じて建設し、福島県に寄付した施設  で、 日本サッカー協会 (JFA) 、 日本プロサッカーリーグ （Jリーグ）、福島県、東京電力などの出資で設立された株式会社Jヴィレッジ（旧社名・株式会社日本フットボールヴィレッジ）が運営管理する。株式会社Jヴィレッジの歴代社長は 福島県知事 、副社長はJFA理事と東京電力 役員（取締役または常務執行役） が務める。実質的な運営統括はJFA理事の副社長が担当しており   、現在の副社長は元 湘南ベルマーレ 監督の 上田栄治  。","https://ja.wikipedia.org/wiki/Jヴィレッジ","日本のサッカー競技場一覧","https://ja.wikipedia.org/wiki/日本のサッカー競技場一覧","箇条書き,制限あり","北緯37度14分39秒東経141度00分07秒","","","","","","","","","","","","","","","","","","",""
"国立西が丘サッカー場","[味の素フィールド西が丘（国立西が丘サッカー場）/ 味フィ西] 西が丘サッカー場 （にしがおかサッカーじょう）は、 東京都 北区 の 国立スポーツ科学センター にある サッカー 専用の球技場である。施設は 独立行政法人日本スポーツ振興センター （以下「JSC」）が所有しており、JSCが運営・管理も行っている。正式な施設名称は「 国立スポーツ科学センター（西が丘）サッカー場 」（こくりつスポーツかがくセンター（にしがおか）サッカーじょう）である  。","https://ja.wikipedia.org/wiki/国立西が丘サッカー場","日本のサッカー競技場一覧","https://ja.wikipedia.org/wiki/日本のサッカー競技場一覧","箇条書き,制限あり","北緯35度46分8.98秒東経139度42分28.29秒","東京都北区西が丘3丁目15−1","独立行政法人日本スポーツ振興センター","北緯35度46分8.98秒東経139度42分28.29秒﻿ / ﻿北緯35.7691611度 東経139.7078583度﻿ /35.7691611; 139.7078583座標:北緯35度46分8.98秒東経139度42分28.29秒﻿ / ﻿北緯35.7691611度 東経139.7078583度﻿ /35.7691611; 139.7078583","独立行政法人日本スポーツ振興センター","天然芝","1972年","","4基","105m×68m","","","2010年","","1969年","","","","",""
"チュウブYAJINスタジアム","[チュウブYAJINスタジアム/ チュスタ] チュウブYAJINスタジアム （チュウブヤジンスタジアム、略称：チュスタ）は、 鳥取県 米子市 にある サッカー 専用 競技場 である。施設は 坂口合名会社 が所有し株式会社SC鳥取へ賃貸  、運営・管理は株式会社SC鳥取および 特定非営利活動法人 やまつみスポーツクラブ が行っている  、","https://ja.wikipedia.org/wiki/チュウブYAJINスタジアム","日本のサッカー競技場一覧","https://ja.wikipedia.org/wiki/日本のサッカー競技場一覧","箇条書き,制限あり","北緯35度26分51.81秒東経133度18分27.67秒","鳥取県米子市安部1-1","坂口合名会社","北緯35度26分51.81秒東経133度18分27.67秒﻿ / ﻿北緯35.4477250度 東経133.3076861度﻿ /35.4477250; 133.3076861座標:北緯35度26分51.81秒東経133度18分27.67秒﻿ / ﻿北緯35.4477250度 東経133.3076861度﻿ /35.4477250; 133.3076861","株式会社SC鳥取特定非営利活動法人やまつみスポーツクラブ","天然芝","2012年12月9日","なし","なし","105 m × 68 m","","所子・美保建設共同体株式会社ホクシン株式会社三徳建設株式会社チュウブ","","約4億円","2012年4月","","","","",""
"群馬県立敷島公園サッカー・ラグビー場","[群馬県立敷島公園サッカー・ラグビー場/ 群馬サ] 群馬県立敷島公園サッカー・ラグビー場 （ぐんまけんりつしきしまこうえんサッカー・ラグビーじょう）は、 群馬県 前橋市 の群馬県立 敷島公園 内にある球技場。施設は群馬県が所有し、敷島パークマネジメントJV（共同企業体）が 指定管理者 として運営管理を行っている。","https://ja.wikipedia.org/wiki/群馬県立敷島公園サッカー・ラグビー場","日本のサッカー競技場一覧","https://ja.wikipedia.org/wiki/日本のサッカー競技場一覧","箇条書き,制限あり","北緯36度24分48.26秒東経139度3分14.0秒","群馬県前橋市敷島町66","群馬県","北緯36度24分48.26秒東経139度3分14.0秒﻿ / ﻿北緯36.4134056度 東経139.053889度﻿ /36.4134056; 139.053889座標:北緯36度24分48.26秒東経139度3分14.0秒﻿ / ﻿北緯36.4134056度 東経139.053889度﻿ /36.4134056; 139.053889","敷島パークマネジメントJV","天然芝","1966年","なし","なし","","","","","","","","","","",""
"テクノポート福井総合公園","[テクノポート福井スタジアム/ 福井] テクノポート福井総合公園 （テクノポートふくいそうごうこうえん）は、 福井県 坂井市 にある公園。施設は福井県が所有し、グリーン・コンソーシアムが 指定管理者 として運営管理を行っている。","https://ja.wikipedia.org/wiki/テクノポート福井総合公園","日本のサッカー競技場一覧","https://ja.wikipedia.org/wiki/日本のサッカー競技場一覧","箇条書き,制限あり","北緯36度11分22.71秒東経136度8分2.57秒","日本福井県坂井市三国町黒目22字51-1","","","","","","","","","","","","","","","グリーン・コンソーシアム","","公式ウェブサイト","芝生広場各種ゴルフ場球技場バーベキュー広場他"
"名古屋市瑞穂公園ラグビー場","[名古屋市瑞穂運動場ラグビー場/ 瑞穂球] 名古屋市瑞穂公園ラグビー場 （なごやしみずほこうえんラグビーじょう）は、 愛知県 名古屋市 瑞穂区 山下通5-4の 名古屋市瑞穂公園 にある フットボール 専用の 球技場 。施設は名古屋市が所有し、 公益財団法人 名古屋市教育スポーツ協会が 指定管理者 として運営管理を行っている。","https://ja.wikipedia.org/wiki/名古屋市瑞穂公園ラグビー場","日本のサッカー競技場一覧","https://ja.wikipedia.org/wiki/日本のサッカー競技場一覧","箇条書き,制限あり","北緯35度7分17.21秒東経136度56分33.17秒","名古屋市瑞穂区山下通5-4","名古屋市","北緯35度7分17.21秒東経136度56分33.17秒﻿ / ﻿北緯35.1214472度 東経136.9425472度﻿ /35.1214472; 136.9425472座標:北緯35度7分17.21秒東経136度56分33.17秒﻿ / ﻿北緯35.1214472度 東経136.9425472度﻿ /35.1214472; 136.9425472","公益財団法人名古屋市教育スポーツ協会","天然芝","","アストロビジョン","鉄塔式4基500Lx","135m×80m","","","1990年3月","","","","","","",""
"三重県鈴鹿スポーツガーデン","[三重交通G スポーツの杜 鈴鹿サッカー・ラグビー場/ 三交鈴鹿] 三重県営鈴鹿スポーツガーデン （みえけんえいすずかスポーツガーデン）は、 三重県 鈴鹿市 にある総合 スポーツ施設 。 1992年 （ 平成 4年）から段階を追ってオープンし、球技場、プール、テニスコート、体育館等を設けている。 指定管理者 は 三重県スポーツ協会  。","https://ja.wikipedia.org/wiki/三重県鈴鹿スポーツガーデン#サッカー・ラグビー場","日本のサッカー競技場一覧","https://ja.wikipedia.org/wiki/日本のサッカー競技場一覧","箇条書き,制限あり","北緯34度50分3.91秒東経136度30分57.47秒","日本三重県鈴鹿市御薗町1669","","","","","","","","","","","","","","","三重県スポーツ協会グループ","運動公園","三重県営鈴鹿スポーツガーデン 公式サイト","水泳場庭球場サッカー・ラグビー場体育館クライミングウォール多目的広場"
"札幌厚別公園競技場","[札幌厚別公園競技場/ 札幌厚別] 札幌厚別公園競技場 （さっぽろあつべつこうえんきょうぎじょう）は、 北海道 札幌市 厚別区 の 厚別公園 内にある 陸上競技場 。施設は札幌市が所有し、札幌市公園緑化協会が 指定管理者 として運営管理を行っている。","https://ja.wikipedia.org/wiki/札幌厚別公園競技場","日本のサッカー競技場一覧","https://ja.wikipedia.org/wiki/日本のサッカー競技場一覧","箇条書き,制限あり","北緯43度1分8.48秒東経141度27分50.83秒","札幌市厚別区上野幌3条1丁目2-1","札幌市","北緯43度1分8.48秒東経141度27分50.83秒﻿ / ﻿北緯43.0190222度 東経141.4641194度﻿ /43.0190222; 141.4641194","札幌市公園緑化協会","天然芝（105m× 70m）（ケンタッキーブルーグラス・トールフェスク・ペレニアルライグラスの3種混合）","1986年","あり（2015年設置）第3コーナー付近に球技用の電光掲示板1基（1998年設置）がある","4基常設ではなく移動照明車使用による","105m × 68m","","","","","","","","","",""
"千代台公園陸上競技場","[千代台公園陸上競技場/ 函館] 千代台公園陸上競技場 （ちよがだいこうえんりくじょうきょうぎじょう）は  、 北海道 函館市 の 千代台公園 にある 陸上競技場 。","https://ja.wikipedia.org/wiki/千代台公園陸上競技場","日本のサッカー競技場一覧","https://ja.wikipedia.org/wiki/日本のサッカー競技場一覧","箇条書き,制限あり","北緯41度47分9.57秒東経140度44分42.99秒","北海道函館市千代台町22-24","函館市","北緯41度47分9.57秒東経140度44分42.99秒﻿ / ﻿北緯41.7859917度 東経140.7452750度﻿ /41.7859917; 140.7452750座標:北緯41度47分9.57秒東経140度44分42.99秒﻿ / ﻿北緯41.7859917度 東経140.7452750度﻿ /41.7859917; 140.7452750","函館市文化・スポーツ振興財団（指定管理者）","","1961年10月29日","","","106 m × 69 m","","","1998年（全面改修）2013年-2014年（ウレタン舗装など）","","","","","","",""
"青森県総合運動公園陸上競技場","[青森県総合運動公園陸上競技場/ 青森] 青森県総合運動公園陸上競技場 （あおもりけん・そうごううんどうこうえん・りくじょうきょうぎじょう）は、 青森県 青森市 の 青森県総合運動公園 にあった 陸上競技場 兼 球技場 。現在は広場として一般開放されている。施設は青森県が所有し、スポルト青い森グループ（鹿内組と大坂組による企業体）が 指定管理者 として運営管理を行っている。","https://ja.wikipedia.org/wiki/青森県総合運動公園陸上競技場","日本のサッカー競技場一覧","https://ja.wikipedia.org/wiki/日本のサッカー競技場一覧","箇条書き,制限あり","北緯40度48分23.62秒東経140度42分27.32秒","青森県青森市安田字近野234-7","青森県","北緯40度48分23.62秒東経140度42分27.32秒﻿ / ﻿北緯40.8065611度 東経140.7075889度﻿ /40.8065611; 140.7075889座標:北緯40度48分23.62秒東経140度42分27.32秒﻿ / ﻿北緯40.8065611度 東経140.7075889度﻿ /40.8065611; 140.7075889","スポルト青い森グループ","","1966年","","","","","","","","","","","","",""
