"札幌サッカーアミューズメントパーク","[札幌サッカーアミューズメントパーク/ 札幌ア] 札幌サッカーアミューズメントパーク （さっぽろ-）とは、 北海道 札幌市 東区 にある サッカー 施設である。略称は「SSAP」が用いられる     。","https://ja.wikipedia.org/wiki/札幌サッカーアミューズメントパーク","日本のサッカー競技場一覧","https://ja.wikipedia.org/wiki/日本のサッカー競技場一覧","箇条書き,制限あり","北緯43度06分01秒東経141度26分00秒","北海道札幌市東区東雁来12条3丁目1-1","","北緯43度06分01秒東経141度26分00秒﻿ / ﻿北緯43.100163度 東経141.433401度﻿ /43.100163; 141.433401座標:北緯43度06分01秒東経141度26分00秒﻿ / ﻿北緯43.100163度 東経141.433401度﻿ /43.100163; 141.433401","北海道スポーツクラブ（特定非営利活動法人）","天然芝1面、人工芝1面（このほか、屋内フットサルコートあり）","","","人工芝コートのみ","105m×68m（天然芝/人工芝ともに）","","","","","","","","","",""
"宮城県サッカー場","[宮城県サッカー場/ 宮城県] 宮城県サッカー場 （みやぎけんサッカーじょう）は、 宮城県 宮城郡 利府町 にある サッカー 専用スタジアムである。同じ利府町にある グランディ・21 宮城スタジアム とは谷筋を挟んで離れているが、 陸橋 を通って2.6 km （車で5分）の距離にある。宮城県の公式サイトには当スタジアムをグランディ・21の一部とみなしている記述がある ","https://ja.wikipedia.org/wiki/宮城県サッカー場","日本のサッカー競技場一覧","https://ja.wikipedia.org/wiki/日本のサッカー競技場一覧","箇条書き,制限あり","北緯38度20分36.0秒東経140度58分23.3秒","宮城県宮城郡利府町森郷字内ノ目南119-1","宮城県","北緯38度20分36.0秒東経140度58分23.3秒﻿ / ﻿北緯38.343333度 東経140.973139度﻿ /38.343333; 140.973139","","A・Bコート：西洋芝Cコート：人工芝","1988年（昭和63年）6月","1基","","","","","","","","","","","",""
"郡山市営西部サッカー場","[郡山市営西部サッカー場/ 郡山] 郡山西部サッカー場 （こおりやませいぶサッカーじょう）は 福島県 郡山市 大槻町 の 大槻公園 内にある サッカー場 である。","https://ja.wikipedia.org/wiki/郡山市営西部サッカー場","日本のサッカー競技場一覧","https://ja.wikipedia.org/wiki/日本のサッカー競技場一覧","箇条書き,制限あり","北緯37度23分45.65秒東経140度18分4.40秒","福島県郡山市大槻町字横山26","郡山市","北緯37度23分45.65秒東経140度18分4.40秒﻿ / ﻿北緯37.3960139度 東経140.3012222度﻿ /37.3960139; 140.3012222座標:北緯37度23分45.65秒東経140度18分4.40秒﻿ / ﻿北緯37.3960139度 東経140.3012222度﻿ /37.3960139; 140.3012222","学校法人国際総合学園FSGカレッジリーグ（指定管理者）","","1994年（平成6年）7月","なし","なし","124m×84m（メイングラウンド）","","","","","","","","","",""
"影森グラウンド (存在しないページ)","[影森グラウンド/ 秩父影森]","https://ja.wikipedia.org/w/index.php?title=影森グラウンド&amp;action=edit&amp;redlink=1","日本のサッカー競技場一覧","https://ja.wikipedia.org/wiki/日本のサッカー競技場一覧","箇条書き,制限あり","","","","","","","","","","","","","","","","","","","",""
"さいたま市大宮公園サッカー場","[NACK5スタジアム大宮（さいたま市大宮公園サッカー場） / NACK] さいたま市大宮公園サッカー場 （さいたまし おおみやこうえん サッカーじょう）は、 埼玉県 さいたま市 大宮区 の 大宮公園 内にある サッカー 専用の 球技場 。同市所有。同市外郭団体 財団法人 さいたま市公園緑地協会が運営管理を行っている。","https://ja.wikipedia.org/wiki/さいたま市大宮公園サッカー場","日本のサッカー競技場一覧","https://ja.wikipedia.org/wiki/日本のサッカー競技場一覧","箇条書き,制限あり","北緯35度54分58.07秒東経139度38分0.16秒","さいたま市大宮区高鼻町4","さいたま市","北緯35度54分58.07秒東経139度38分0.16秒﻿ / ﻿北緯35.9161306度 東経139.6333778度﻿ /35.9161306; 139.6333778座標:北緯35度54分58.07秒東経139度38分0.16秒﻿ / ﻿北緯35.9161306度 東経139.6333778度﻿ /35.9161306; 139.6333778","（財）さいたま市公園緑地協会","天然芝","1960年4月","オーロラビジョン","鉄塔式4基","105 x 68m","NTTファシリティーズ（改修）","戸田・株木・ユーディーケー特定JV（改修）","","40億円（改修）","","1964年、2007年","","","",""
"埼玉スタジアム2002第2グラウンド","[埼玉スタジアム2002第2グラウンド/ 埼スタ2] 埼玉スタジアム2002 （さいたまスタジアム にまるまるに  ）は、 埼玉県 さいたま市 緑区 の 埼玉スタジアム2002公園 内にある サッカー 専用の競技スタジアム。","https://ja.wikipedia.org/wiki/埼玉スタジアム2002第2グラウンド","日本のサッカー競技場一覧","https://ja.wikipedia.org/wiki/日本のサッカー競技場一覧","箇条書き,制限あり","北緯35度54分11.19秒東経139度43分3.37秒","埼玉県さいたま市緑区美園二丁目1番地","埼玉県","北緯35度54分11.19秒東経139度43分3.37秒﻿ / ﻿北緯35.9031083度 東経139.7176028度﻿ /35.9031083; 139.7176028座標:北緯35度54分11.19秒東経139度43分3.37秒﻿ / ﻿北緯35.9031083度 東経139.7176028度﻿ /35.9031083; 139.7176028","公益財団法人埼玉県公園緑地協会","天然芝","2001年10月6日","オーロラビジョン2基","平均2,000ルクス(ハイビジョン放送対応)","105 m x 68 m","埼玉県県土整備部スタジアム施設課（設計・監理）、梓設計（管理）","鹿島建設（施工建築）","","約356億円（設計価格 約404億円）（用地費等含む公園整備総額766億円）","1998年5月9日","","","","",""
"習志野市秋津公園サッカー場","[フロンティアサッカーフィールド（習志野市秋津公園サッカー場）/ 秋フロ] 習志野市秋津サッカー場 （ならしのし あきつサッカーじょう）は、 千葉県 習志野市 の秋津総合運動公園にあるサッカー専用 スタジアム である。施設は習志野市が所有し、 公益財団法人 習志野市スポーツ振興協会が 指定管理者 として運営管理を行っている。","https://ja.wikipedia.org/wiki/習志野市秋津公園サッカー場","日本のサッカー競技場一覧","https://ja.wikipedia.org/wiki/日本のサッカー競技場一覧","箇条書き,制限あり","北緯35度40分10.9秒東経140度0分44.8秒","千葉県習志野市秋津3-7-3","習志野市","北緯35度40分10.9秒東経140度0分44.8秒﻿ / ﻿北緯35.669694度 東経140.012444度﻿ /35.669694; 140.012444座標:北緯35度40分10.9秒東経140度0分44.8秒﻿ / ﻿北緯35.669694度 東経140.012444度﻿ /35.669694; 140.012444","公益財団法人習志野市スポーツ振興協会","","","なし","4基","","","","","","","","","","",""
"国立西が丘サッカー場","[味の素フィールド西が丘（国立西が丘サッカー場）/ 味フィ西] 西が丘サッカー場 （にしがおかサッカーじょう）は、 東京都 北区 の 国立スポーツ科学センター にある サッカー 専用の球技場である。施設は 独立行政法人日本スポーツ振興センター （以下「JSC」）が所有しており、JSCが運営・管理も行っている。正式な施設名称は「 国立スポーツ科学センター（西が丘）サッカー場 」（こくりつスポーツかがくセンター（にしがおか）サッカーじょう）である  。","https://ja.wikipedia.org/wiki/国立西が丘サッカー場","日本のサッカー競技場一覧","https://ja.wikipedia.org/wiki/日本のサッカー競技場一覧","箇条書き,制限あり","北緯35度46分8.98秒東経139度42分28.29秒","東京都北区西が丘3丁目15−1","独立行政法人日本スポーツ振興センター","北緯35度46分8.98秒東経139度42分28.29秒﻿ / ﻿北緯35.7691611度 東経139.7078583度﻿ /35.7691611; 139.7078583座標:北緯35度46分8.98秒東経139度42分28.29秒﻿ / ﻿北緯35.7691611度 東経139.7078583度﻿ /35.7691611; 139.7078583","独立行政法人日本スポーツ振興センター","天然芝","1972年","","4基","105m×68m","","","2010年","","1969年","","","","",""
"神奈川県立保土ヶ谷公園サッカー場","[神奈川県立保土ヶ谷公園サッカー場/ 保土ヶ谷] 神奈川県立保土ケ谷公園サッカー場 （かながわけんりつ・ほどがやこうえん・サッカーじょう）は、 横浜市 保土ケ谷区 の 保土ケ谷公園 にある 球技場 。","https://ja.wikipedia.org/wiki/神奈川県立保土ヶ谷公園サッカー場","日本のサッカー競技場一覧","https://ja.wikipedia.org/wiki/日本のサッカー競技場一覧","箇条書き,制限あり","北緯35度27分17.6秒 東経139度35分5.3秒","","","","","","","","","","","","","","","","","","",""
"新潟聖籠スポーツセンター","[新潟聖籠スポーツセンター/ 聖籠] 新潟聖籠スポーツセンター （にいがたせいろうスポーツセンター）は、 新潟県 北蒲原郡 聖籠町 にある サッカー 練習場を中心としたスポーツ施設である。通称は アルビレッジ 。運営管理は 特定非営利活動法人 新潟スポーツコミュニティが行っている。","https://ja.wikipedia.org/wiki/新潟聖籠スポーツセンター","日本のサッカー競技場一覧","https://ja.wikipedia.org/wiki/日本のサッカー競技場一覧","箇条書き,制限あり","北緯37度59分11.88秒東経139度14分52.6秒","日本新潟県北蒲原郡聖籠町東港5-1923-12","","","","","","","","","公園設計：クレイズプラン","","","","","","特定非営利活動法人新潟スポーツコミュニティ","","公式ウェブサイト","サッカーフィールド他"
"磐田スポーツ交流の里・ゆめりあ","[磐田スポーツ交流の里・ゆめりあ/ ゆめりあ] 磐田スポーツ交流の里・ゆめりあ （いわたスポーツこうりゅうのさと・ゆめりあ）は、 静岡県 磐田市 の市営スポーツ施設である。運営管理は 財団法人 磐田市振興公社が行っている。","https://ja.wikipedia.org/wiki/磐田スポーツ交流の里・ゆめりあ","日本のサッカー競技場一覧","https://ja.wikipedia.org/wiki/日本のサッカー競技場一覧","箇条書き,制限あり","北緯34度45分20.65秒東経137度51分27.97秒","日本静岡県磐田市大久保892-36","","","","","","","","","","","","","","","財団法人磐田市振興公社","","","サッカー場多目的広場フットサル場他"
"高槻市萩谷総合運動公園","[高槻市萩谷総合運動公園サッカー場/ 高槻萩谷] 萩谷総合公園 （はぎたにそうごうこうえん）は、 大阪府 高槻市 にある 都市公園 （ 総合公園 ）である  。","https://ja.wikipedia.org/wiki/高槻市萩谷総合運動公園","日本のサッカー競技場一覧","https://ja.wikipedia.org/wiki/日本のサッカー競技場一覧","箇条書き,制限あり","北緯34度53分6秒東経135度34分4秒","日本大阪府高槻市大字萩谷111-1","","","","","","","","","","","","","","","高槻市","都市公園（総合公園）","高槻市のサイト","サッカー場、テニスコート（8面、人工芝）、野球場、調整池、水路、散策園路"
"堺市立サッカー・ナショナルトレーニングセンター","[堺市立サッカー・ナショナルトレーニングセンター/ J-G堺メイン] 堺市立サッカー・ナショナルトレーニングセンター （さかいしりつサッカー・ナショナルトレーニングセンター）は、 大阪府 堺市 堺区 築港八幡町にある サッカー 練習場を中心としたスポーツ施設。愛称は J-GREEN堺 （ジェイ・グリーンさかい）。略称は堺トレセン、堺NTCなど。ジェイズパークグループ（代表団体：株式会社ジャパンフットボールマーチャンダイズ、構成団体： 日本管財 、関西ユニベール株式会社）が 指定管理者 として運営管理を行っている。","https://ja.wikipedia.org/wiki/堺市立サッカー・ナショナルトレーニングセンター","日本のサッカー競技場一覧","https://ja.wikipedia.org/wiki/日本のサッカー競技場一覧","箇条書き,制限あり","北緯34度36分14.69秒東経135度26分38.1秒","日本大阪府堺市堺区築港八幡町145","","","","","","","","","","","","","","","ジェイズパークグループ","","","#施設を参照。"
"五色台運動公園","[五色台運動公園（アスパ五色）/ 五色] 五色台運動公園 （ごしきだいうんどうこうえん）は、 兵庫県 洲本市 にある 運動公園 。通称「 アスパ五色 」。通称のアスパ (ASPA) は「淡路スポーツパーク」 ( A waji S ports PA rk) の略称（頭文字）からつけられている。","https://ja.wikipedia.org/wiki/五色台運動公園","日本のサッカー競技場一覧","https://ja.wikipedia.org/wiki/日本のサッカー競技場一覧","箇条書き,制限あり","北緯34度21分18.5秒東経134度45分23.6秒","日本兵庫県洲本市","","","","","","","","","","","","","","","洲本市教育委員会体育保健課","都市公園","www1.sumoto.gr.jp/asupa/index.html",""
"仙台スタジアム","[ユアテックスタジアム仙台（仙台スタジアム） / ユアスタ] 仙台スタジアム （せんだいスタジアム）は、 宮城県 仙台市 泉区 の 七北田公園 にある サッカー 、 ラグビー 、 アメリカンフットボール の 球技場 である。施設は仙台市が所有し、仙台市公園緑地協会・日本体育施設グループが 指定管理者 として運営管理を行っている。","https://ja.wikipedia.org/wiki/仙台スタジアム","日本のサッカー競技場一覧","https://ja.wikipedia.org/wiki/日本のサッカー競技場一覧","箇条書き,制限あり","北緯38度19分9秒東経140度52分54.5秒","宮城県仙台市泉区七北田字柳78","仙台市","北緯38度19分9秒東経140度52分54.5秒﻿ / ﻿北緯38.31917度 東経140.881806度﻿ /38.31917; 140.881806座標:北緯38度19分9秒東経140度52分54.5秒﻿ / ﻿北緯38.31917度 東経140.881806度﻿ /38.31917; 140.881806","仙台市公園緑地協会・日本体育施設グループ","天然芝（139m×79m）","1997年（平成9年）6月1日","2基","1,500Lx/ 750Lx / 300Lx","105m×68m","北海道開発コンサルタント","鹿島建設・大末建設・奥田建設JV","","約130億円","","","","","",""
"石巻フットボール場","[石巻フットボール場/ 石巻フ] 石巻フットボール場 （いしのまきフットボールじょう）は、 宮城県 石巻市 南境の 石巻市総合運動公園 内にある サッカー ・ ラグビー 専用 競技場 。サッカー場のピッチサイズは105m×68m。","https://ja.wikipedia.org/wiki/石巻フットボール場","日本のサッカー競技場一覧","https://ja.wikipedia.org/wiki/日本のサッカー競技場一覧","箇条書き,制限あり","北緯38度27分27.9秒東経141度18分33.5秒","宮城県石巻市南境字新小堤18番地","石巻市","北緯38度27分27.9秒東経141度18分33.5秒﻿ / ﻿北緯38.457750度 東経141.309306度﻿ /38.457750; 141.309306座標:北緯38度27分27.9秒東経141度18分33.5秒﻿ / ﻿北緯38.457750度 東経141.309306度﻿ /38.457750; 141.309306","","天然芝","","なし","なし","174m× 84m （サッカー場のピッチサイズは105m×68m）","","","","","","","","","",""
"いわきグリーンフィールド","[いわきグリーンフィールド/ いわき] いわきグリーンフィールド は、 福島県 いわき市 の21世紀の森公園にある 球技場 。","https://ja.wikipedia.org/wiki/いわきグリーンフィールド","日本のサッカー競技場一覧","https://ja.wikipedia.org/wiki/日本のサッカー競技場一覧","箇条書き,制限あり","北緯37度1分2.3秒東経140度51分51.7秒","福島県いわき市常磐水野谷町竜ケ沢308","いわき市","北緯37度1分2.3秒東経140度51分51.7秒﻿ / ﻿北緯37.017306度 東経140.864361度﻿ /37.017306; 140.864361座標:北緯37度1分2.3秒東経140度51分51.7秒﻿ / ﻿北緯37.017306度 東経140.864361度﻿ /37.017306; 140.864361","いわき市公園緑地観光公社（指定管理者）","天然芝","1995年4月","なし","なし","150 x 70 m","","","","約15億円","","","","","",""
"狭山赤坂の森公園多目的グラウンド (存在しないページ)","[狭山赤坂の森公園多目的グラウンド/ 狭山]","https://ja.wikipedia.org/w/index.php?title=狭山赤坂の森公園多目的グラウンド&amp;action=edit&amp;redlink=1","日本のサッカー競技場一覧","https://ja.wikipedia.org/wiki/日本のサッカー競技場一覧","箇条書き,制限あり","","","","","","","","","","","","","","","","","","","",""
"フクダ電子アリーナ","[フクダ電子アリーナ/ フクアリ] 千葉市の 条例 上の名称は 千葉市蘇我球技場 （ちばしそがきゅうぎじょう）であるが、開業当初から医療機器の製造販売を行う フクダ電子 が施設 命名権 を取得し、「フクダ電子アリーナ」の名称を用いている（ 後述 ）。略称は フクアリ 。","https://ja.wikipedia.org/wiki/フクダ電子アリーナ","日本のサッカー競技場一覧","https://ja.wikipedia.org/wiki/日本のサッカー競技場一覧","箇条書き,制限あり","北緯35度34分38.95秒東経140度7分22.34秒","千葉県千葉市中央区川崎町1-20","千葉市","北緯35度34分38.95秒東経140度7分22.34秒﻿ / ﻿北緯35.5774861度 東経140.1228722度﻿ /35.5774861; 140.1228722座標:北緯35度34分38.95秒東経140度7分22.34秒﻿ / ﻿北緯35.5774861度 東経140.1228722度﻿ /35.5774861; 140.1228722","SSP UNITED","天然芝","2005年10月","オーロラビジョン","","111m×74m","日本設計安宅防災設計都市再生機構","清水建設・大林組・新日本建設JV、関電工・JFE電制・モデン工業JV、日本電設工業・橋本電業社JV、川崎設備工業・芝工業JV、朝日工業社・川本工業・京葉工管JV","","81億円","2003年12月","","","","",""
"南長野運動公園総合球技場","[長野Uスタジアム/ 長野U] 南長野運動公園総合球技場 （みなみながのうんどうこうえん そうごうきゅうぎじょう）は、 長野県 長野市 の 南長野運動公園 にある サッカー ・ ラグビー 等の球技専用のスタジアムである。施設は長野市が所有し、南長野スポーツマネージメント共同事業体が 指定管理者 として運営管理を行っている。","https://ja.wikipedia.org/wiki/南長野運動公園総合球技場","日本のサッカー競技場一覧","https://ja.wikipedia.org/wiki/日本のサッカー競技場一覧","箇条書き,制限あり","北緯36度34分49.27秒東経138度10分3.2秒","長野県長野市篠ノ井東福寺字上組北320","長野市","北緯36度34分49.27秒東経138度10分3.2秒﻿ / ﻿北緯36.5803528度 東経138.167556度﻿ /36.5803528; 138.167556座標:北緯36度34分49.27秒東経138度10分3.2秒﻿ / ﻿北緯36.5803528度 東経138.167556度﻿ /36.5803528; 138.167556","南長野スポーツマネージメント共同事業体","天然芝","2002年（旧スタジアム）2015年3月（新スタジアム）","","","120m×80m","竹中工務店・東畑建築事務所・アーキプラン","竹中工務店・北信土建・千広建設","2014年1月-2015年2月","71億4千万円","","","","","",""
"静岡県草薙総合運動場球技場","[静岡県草薙総合運動場球技場/ 草薙球技] 静岡県草薙総合運動場球技場 （しずおかけん・くさなぎそうごううんどうじょう・きゅうぎじょう）は、 静岡県 静岡市 駿河区 の 静岡県草薙総合運動場 内にある 球技場 。 サッカー 、 ラグビー などで使用される。施設は静岡県が所有し、東京ドーム・東急・静鉄共同事業体（代表団体： 東京ドーム ）が 指定管理者 として運営管理を行っている。","https://ja.wikipedia.org/wiki/静岡県草薙総合運動場球技場","日本のサッカー競技場一覧","https://ja.wikipedia.org/wiki/日本のサッカー競技場一覧","箇条書き,制限あり","北緯34度59分19.9秒東経138度25分56.3秒","静岡県静岡市駿河区栗原19－1","静岡県","北緯34度59分19.9秒東経138度25分56.3秒﻿ / ﻿北緯34.988861度 東経138.432306度﻿ /34.988861; 138.432306座標:北緯34度59分19.9秒東経138度25分56.3秒﻿ / ﻿北緯34.988861度 東経138.432306度﻿ /34.988861; 138.432306","東京ドーム・東急・静鉄共同事業体","天然芝","","なし","","156m × 89m","","","","","","","","","",""
"ヤマハスタジアム","[ヤマハスタジアム（磐田）/ ヤマハ] ヤマハスタジアム （Yamaha Stadium）は、 静岡県 磐田市 にある サッカー や ラグビー に使用される球技専用 スタジアム である  。なお、施設は ヤマハ発動機 が所有し、運営管理も同社が行っている   。なお、磐田市（磐田市観光協会）やヤマハ発動機、 日本プロサッカーリーグ （Jリーグ）などのスタジアム呼称は ヤマハスタジアム（磐田） である    。","https://ja.wikipedia.org/wiki/ヤマハスタジアム","日本のサッカー競技場一覧","https://ja.wikipedia.org/wiki/日本のサッカー競技場一覧","箇条書き,制限あり","北緯34度43分30.78秒東経137度52分30.02秒","静岡県磐田市新貝2500","ヤマハ発動機","北緯34度43分30.78秒東経137度52分30.02秒﻿ / ﻿北緯34.7252167度 東経137.8750056度﻿ /34.7252167; 137.8750056座標:北緯34度43分30.78秒東経137度52分30.02秒﻿ / ﻿北緯34.7252167度 東経137.8750056度﻿ /34.7252167; 137.8750056","","ティフトン芝（111m × 74.5m）","1978年","オーロラビジョン","4基","105m × 68 m","","","","","","1993年、1995年、1997年、2013年","","","",""
"名古屋市港サッカー場","[名古屋市港サッカー場/ 名古屋港] 名古屋市港サッカー場 （なごやしみなとサッカーじょう）は、 愛知県 名古屋市 港区 の 稲永公園 内にある球技場。施設は 名古屋市 が所有し、財団法人名古屋市教育スポーツ振興事業団が 指定管理者 として運営管理を行っている。","https://ja.wikipedia.org/wiki/名古屋市港サッカー場","日本のサッカー競技場一覧","https://ja.wikipedia.org/wiki/日本のサッカー競技場一覧","箇条書き,制限あり","北緯35度4分33.96秒東経136度51分2.46秒","日本名古屋市港区野跡4-11-12","名古屋市","北緯35度4分33.96秒東経136度51分2.46秒﻿ / ﻿北緯35.0761000度 東経136.8506833度﻿ /35.0761000; 136.8506833座標:北緯35度4分33.96秒東経136度51分2.46秒﻿ / ﻿北緯35.0761000度 東経136.8506833度﻿ /35.0761000; 136.8506833","財団法人名古屋市教育スポーツ振興事業団","天然芝","1993年","電光掲示板","鉄塔式 4基","146m x 83m","","","","","","","","","",""
"三重県営鈴鹿スポーツガーデン","[三重交通G スポーツの杜 鈴鹿/ 三交鈴鹿] 三重県営鈴鹿スポーツガーデン （みえけんえいすずかスポーツガーデン）は、 三重県 鈴鹿市 にある総合 スポーツ施設 。 1992年 （ 平成 4年）から段階を追ってオープンし、球技場、プール、テニスコート、体育館等を設けている。 指定管理者 は 三重県スポーツ協会  。","https://ja.wikipedia.org/wiki/三重県営鈴鹿スポーツガーデン","日本のサッカー競技場一覧","https://ja.wikipedia.org/wiki/日本のサッカー競技場一覧","箇条書き,制限あり","北緯34度50分3.91秒東経136度30分57.47秒","日本三重県鈴鹿市御薗町1669","","","","","","","","","","","","","","","三重県スポーツ協会グループ","運動公園","三重県営鈴鹿スポーツガーデン 公式サイト","水泳場庭球場サッカー・ラグビー場体育館クライミングウォール多目的広場"
"南津守さくら公園","[南津守さくら公園スポーツ広場 / 南津守G] 南津守さくら公園 （みなみつもりさくらこうえん）は、 大阪市 西成区 南津守 1丁目にある都市公園（地区公園）である  。","https://ja.wikipedia.org/wiki/南津守さくら公園","日本のサッカー競技場一覧","https://ja.wikipedia.org/wiki/日本のサッカー競技場一覧","箇条書き,制限あり","北緯34度38分10.96秒東経135度29分1.2秒","日本大阪市西成区南津守1丁目2-36","","","","","","","","","","","","","","","大阪市","都市公園（地区公園）","","スポーツ広場・テニスコート・児童遊園"
