"タイトル","コメント","URL","親リストタイトル","親リストURL","一覧抽出方法","座標","所在地","種類","国・地域","運営者","標高","方向","運用時間","公式サイト","敷地面積","開港","旅客数","貨物取扱量","所有者","母都市","発着回数","所在部隊","開設","面積","国"
"成田国際空港","[関東：成田国際空港（成田空港）] 東京国際空港 とともに 首都圏 の「空の玄関」である。","https://ja.wikipedia.org/wiki/成田国際空港","日本の空港","https://ja.wikipedia.org/wiki/日本の空港","箇条書き,制限あり","北緯35度45分55秒東経140度23分08秒","千葉県成田市・山武郡芝山町・香取郡多古町","民間、商業","日本","成田国際空港株式会社","43m(141ft)","16R/34L","6:00 - 24:00","https://www.narita-airport.jp/jp/","1,137ha","1978年5月20日","44,344,739人","2,039,905t","成田国際空港株式会社（日本国政府出資）","東京","264,115回","","","",""
"中部国際空港","[中部：中部国際空港（セントレア）] 愛知県 名古屋市 の中心部から南へ約35km、 知多半島 の愛知県常滑市の沖合約1.5kmの 伊勢湾 海上の人工島に位置し、24時間運用可能な長さ3,500mの滑走路を有する、 関西国際空港 に次ぐ国内第2の海上 国際空港 として 2005年 2月17日 に開港した。 成田国際空港 、 東京国際空港 、関西国際空港とともに国際航空路線に必要な国際 拠点空港 としてその航空需要を担うことを国の航空政策上位置づけられている    。","https://ja.wikipedia.org/wiki/中部国際空港","日本の空港","https://ja.wikipedia.org/wiki/日本の空港","箇条書き,制限あり","北緯34度51分30秒東経136度48分19秒","愛知県常滑市","商業","日本","中部国際空港株式会社","3.7m(12.1ft)","18/36","24時間","中部国際空港 セントレア","471.3ha","2005年2月17日","12,257,342人","176,722t","","名古屋市","106,008回","","","",""
"関西国際空港","[関西：関西国際空港（関空）※2016年7月1日よりコンセッション方式で運営] 1994年 9月4日 開港。 大阪湾 内 泉州 沖5kmの埋立地（ 泉南郡 田尻町 ・ 泉佐野市 ・ 泉南市 にまたがる  ）にある世界で初めての完全人工島からなる 海上空港 である（ #空港島 を参照）。通称・略称は、 関西空港 （かんさいくうこう）あるいは 関空 （かんくう）、 空港コード KIXから「キックス」と呼ばれることもある    。 空港法 上の 拠点空港 であり、 成田国際空港 、 東京国際空港 （羽田空港）、 中部国際空港 （セントレア）とともに日本を代表する国際空港として 国際拠点空港   のひとつと位置づけられている。 成田国際空港 とともに大都市圏にある国際線専用空港という傾向が強い。「西日本を中心とする国際拠点空港であり、近畿圏の国内線の基幹空港  」と位置づけられており、関西地方の空港で唯一、定期国際線が就航している。また、成田国際空港などと並んで Peach Aviation などの 格安航空会社 （LCC）の拠点空港であり、国内やアジア各都市を結んでいる。 航空法 上の 混雑空港 に指定されており、 国際航空運送協会 （IATA）が混雑度レベル2に指定している  。本空港建造事業は 内閣総理大臣顕彰 を授与されており、また、日本国外からも様々な評価を受けている（ #日本国外からの評価 を参照）。","https://ja.wikipedia.org/wiki/関西国際空港","日本の空港","https://ja.wikipedia.org/wiki/日本の空港","箇条書き,制限あり","北緯34度26分03秒東経135度13分58秒","大阪府泉南郡田尻町泉佐野市泉南市","商業","日本","関西エアポート株式会社","5.30m(17.4ft)","06R/24L","24時間","関西国際空港公式サイト","1,067.7ha","1994年9月4日","28,762,999人","756,771t","","大阪市","196,022回","","","",""
"大阪国際空港","[関西 :大阪国際空港（伊丹空港）※2016年7月1日よりコンセッション方式で運営] 大阪国際空港 （おおさかこくさいくうこう、 英 ：Osaka International Airport）は、 大阪府 豊中市 、同府 池田市 、 兵庫県 伊丹市 にまたがる 会社管理空港 である。 大阪空港 （おおさかくうこう）あるいは 伊丹空港 （いたみくうこう、 英 ：Itami Airport）の通称でも知られる。かつては名実ともに 国際空港 であったが、現在は日本の国内線の 拠点空港 （基幹空港）として運用されている。近隣の 関西国際空港 、 神戸空港 とともに 関西三空港 のひとつである。空港運営は 関西エアポート が実施している。","https://ja.wikipedia.org/wiki/大阪国際空港","日本の空港","https://ja.wikipedia.org/wiki/日本の空港","箇条書き,制限あり","北緯34度47分04秒東経135度26分21秒","大阪府豊中市大阪府池田市兵庫県伊丹市","商業","日本","関西エアポート株式会社","12m(39ft)","14L/32R","7:00 - 21:00","大阪国際空港（伊丹空港）","311.9ha","","","","","大阪市","","","","",""
"新千歳空港","[北海道：新千歳空港※2020年6月1日よりコンセッション方式で運営、稚内空港、函館空港、釧路空港（たんちょう釧路空港）] 北海道の経済・文化の中心地・ 札幌市 の南東約40kmに位置する国内線の基幹空港。 空港法 に基づいて 国土交通大臣 が設置・管理する 国管理空港 で、国際線や国内線の拠点空港に区分される。空港の利用者数は国内で5番目に多い  。また、旅客数では羽田-新千歳線が世界一位になったこともある。北海道では最大の空港で、鉄道や高速道路もよく整備されているため、実質的に北海道の空の玄関口となっている。","https://ja.wikipedia.org/wiki/新千歳空港","日本の空港","https://ja.wikipedia.org/wiki/日本の空港","箇条書き,制限あり","北緯42度46分30秒東経141度41分32秒","北海道千歳市","商業","日本","北海道エアポート","21.3m","01L/19R","24時間","新千歳空港","726ha","1988年7月20日","21,545,032","204,693","国土交通省","札幌市","72,676","","","",""
"仙台空港","[東北：仙台空港（仙台国際空港）※2016年7月1日よりコンセッション方式で運営] 仙台空港 （せんだいくうこう）は、 宮城県 名取市 と 岩沼市 に跨って位置する 東北地方 唯一の 国管理空港 （旧第二種(A)空港）である  。 2016年 7月1日 に運営が 仙台国際空港株式会社 に移管（民営化）された  。 空港ターミナルビル が名取市にあり、 滑走路 が岩沼市に及ぶ。愛称は 仙台国際空港  。","https://ja.wikipedia.org/wiki/仙台空港","日本の空港","https://ja.wikipedia.org/wiki/日本の空港","箇条書き,制限あり","北緯38度08分13秒東経140度55分21秒","宮城県名取市・岩沼市","商業","日本","仙台国際空港株式会社","5m(16.4ft)","12/30","7:30 - 21:30","仙台空港ターミナル","","","","","","仙台市","","","","",""
"東京国際空港","[関東：東京国際空港（羽田空港）] 成田国際空港 と並ぶ、 首都圏 の「空の玄関」である  。2019年の乗降客数は、世界5位となった  。","https://ja.wikipedia.org/wiki/東京国際空港","日本の空港","https://ja.wikipedia.org/wiki/日本の空港","箇条書き,制限あり","北緯35度33分12秒東経139度46分52秒","東京都大田区羽田空港","公共","日本","国土交通大臣","6.4m(21ft)","16R/34L","24時間","tokyo-haneda.com","1,516ha","1931年8月25日 (89年前) (1931-08-25)","84,893,742","1,271,143t","国土交通省","東京","","","","",""
"新潟空港","[中部：新潟空港] 新潟空港 （にいがたくうこう）は、 新潟県 新潟市 東区 にある 国管理空港  。","https://ja.wikipedia.org/wiki/新潟空港","日本の空港","https://ja.wikipedia.org/wiki/日本の空港","箇条書き,制限あり","北緯37度57分21秒東経139度07分14秒","新潟県新潟市東区","商業","日本","国土交通大臣","9m(29ft)","04/22","7:30 - 21:30 (JST)","新潟空港","","","993,980人","454t","","","13,372","","","",""
"広島空港","[中国：広島空港] 1993年 （ 平成 5年）10月に開港   。 広島市 中心部から東方50 ㎞ 、三原市 本郷町 善入寺 字 平岩64-31に位置している（ 地図 ）。年間利用客数は、2014年度で国内2,437,574人、国際283,630人  。 中国地方 最大であり、2番目に多い 岡山空港 の約2倍である（→ 中国地方#空港 ）。2006年には ターミナル の旅客処理能力を500万人程度まで高める事業の一環として、 搭乗橋 が新たに追加増設された。","https://ja.wikipedia.org/wiki/広島空港","日本の空港","https://ja.wikipedia.org/wiki/日本の空港","箇条書き,制限あり","北緯34度26分10秒東経132度55分10秒","広島県三原市","商業","日本","広島国際空港株式会社","331m(1,086ft)","10/28","7:30 - 22:30","広島空港","197.7ha","1993年10月29日","2,885,054人","20,486t","","","","","","",""
"高松空港","[四国：高松空港※2018年4月1日よりコンセッション方式で運営、松山空港、高知空港（高知龍馬空港）] 高松市の中心部から南へ約15kmの香南台地に、 1989年 12月 開港  （ #空港移転の経緯 を参照）。標高185mの高台にあるため、 霧 が発生しやすく  、霧による視界不良を原因とした到着便の出発地への引き返しや降着地の変更、およびそれに伴う折り返し便の欠航が年に数回起きる  。","https://ja.wikipedia.org/wiki/高松空港","日本の空港","https://ja.wikipedia.org/wiki/日本の空港","箇条書き,制限あり","北緯34度12分51秒東経134度00分56秒","香川県高松市","商業","日本","高松空港株式会社","185m(607ft)","08/26","7:00 - 22:00","高松空港","153.9ha","","1,761,608人","11.6t","","","","","","",""
"福岡空港","[九州：福岡空港※2019年4月1日よりコンセッション方式で運営、北九州空港、長崎空港、熊本空港（阿蘇くまもと空港）※2020年4月1日よりコンセッション方式で運営[33] 福岡市街地から5km以内という至近距離に位置しており、アクセスの良い空港として知られる。1993年に 福岡市地下鉄空港線 が国内線ターミナル直下に乗り入れ、 博多駅 まで約5分、 天神駅 ・ 西鉄福岡（天神）駅 ・まで約11分で結んでいるほか、 福岡都市高速 の ランプ も至近に所在し、 九州自動車道 太宰府インターチェンジ への所要時間は15分から20分程度となっている。新幹線が発着する博多駅に近いため広域のアクセスがよく、九州北部から山口県に渡る広範囲から利用客を集めている。","https://ja.wikipedia.org/wiki/福岡空港","日本の空港","https://ja.wikipedia.org/wiki/日本の空港","箇条書き,制限あり","北緯33度35分04秒東経130度27分06秒","福岡県福岡市博多区","商業","日本","福岡国際空港","9.1m(30ft)","16/34","24時間(但し定期便の運用は通常7:00 - 22:00迄に制限)","福岡空港公式サイト","353ha","1945年","23,979,222人","258,559t","","","89,261回（着陸回数）","","","",""
"那覇空港","[沖縄：那覇空港] 1933年 （ 昭和 8年）8月、 日本軍 は半農半漁の集落として栄えた旧 小禄村 大嶺（ウフンミ）の土地を強制接収し   、 海軍 の 軍用飛行場 、小禄飛行場（小禄海軍飛行場・海軍小禄飛行場）を建設した。","https://ja.wikipedia.org/wiki/那覇空港","日本の空港","https://ja.wikipedia.org/wiki/日本の空港","箇条書き,制限あり","北緯26度12分20秒東経127度39分03秒","沖縄県那覇市字鏡水","軍民共用","日本","国土交通大臣","3.3m","18L/36R","24時間","那覇空港旅客ターミナルビル","327.8ha","","","","","","","","","",""
"旭川空港","[北海道：旭川空港（北海道のまん中・旭川空港）、帯広空港（とかち帯広空港）] 北海道 第2の都市旭川市中心部から南東約16km（バスで約35分）の田園地帯に囲まれた丘陵地帯に位置する  。旭川を中心とした 道北 の経済、文化、観光の拠点である。空港の東側には、日本最大の 国立公園 である 大雪山 連峰と、これに続く 十勝岳 連峰の山々がある。","https://ja.wikipedia.org/wiki/旭川空港","日本の空港","https://ja.wikipedia.org/wiki/日本の空港","箇条書き,制限あり","北緯43度40分15秒東経142度26分51秒","北海道上川郡東神楽町","商業","日本","北海道エアポート","210.5m(692ft)","16/34","8:00 - 21:00","旭川空港ターミナル","214ha","1966年6月30日","1,110,137人","4,964t","","旭川市","","","","",""
"秋田空港","[東北：秋田空港、山形空港（おいしい山形空港）] 1981年 （昭和56年）6月26日に開港  。秋田市中心部から南東に約20kmの 河辺郡 雄和町 （現・秋田市）の 雄物川 と 岩見川 に挟まれた 安養寺川 上流の 丘陵地  に位置する。 東北地方 では最も早く2,500m 滑走路 を整備した空港であった。","https://ja.wikipedia.org/wiki/秋田空港","日本の空港","https://ja.wikipedia.org/wiki/日本の空港","箇条書き,制限あり","北緯39度36分56秒東経140度13分07秒","秋田県秋田市雄和椿川","商業","日本","秋田県","93.1m(305ft)","10/28","7:00 - 22:00","秋田空港","159ha","1981年6月26日","1,228,136人","2,009t","","","","","","",""
"山口宇部空港","[中国：山口宇部空港] 山口宇部空港 （やまぐちうべくうこう Yamaguchi-Ube Airport ）は、 山口県 宇部市 に所在する 特定地方管理空港 である。本州の空港としては最西端に位置する。","https://ja.wikipedia.org/wiki/山口宇部空港","日本の空港","https://ja.wikipedia.org/wiki/日本の空港","箇条書き,制限あり","北緯33度55分48秒東経131度16分43秒","山口県宇部市沖宇部字八王子625-17","商業","日本","山口県","7m(23ft)","07/25","7:30 - 21:30","http://www.yamaguchiube-airport.jp/","155ha","1966年（昭和41年）7月1日","","","","","","","","",""
"利尻空港","[北海道：利尻空港、礼文空港、奥尻空港、中標津空港（根室中標津空港）、女満別空港、紋別空港（オホーツク紋別空港）] 利尻空港は 利尻島 北端に位置する北海道内の最初の 離島 空港である。ジェット機の就航が可能であり、地域経済の活性化及び地域振興、島民の重要な生活基盤施設として期待されている。","https://ja.wikipedia.org/wiki/利尻空港","日本の空港","https://ja.wikipedia.org/wiki/日本の空港","箇条書き,制限あり","北緯45度14分23秒東経141度11分29秒","北海道利尻郡利尻富士町","商業","日本","北海道","30.7m(100.7ft)","07/25","9:00 - 17:00","","","","","","","","","","","",""
"青森空港","[東北：青森空港、花巻空港（いわて花巻空港）、大館能代空港（あきた北空港）、庄内空港（おいしい庄内空港）、福島空港] 青森市中心部から南方に約10キロメートル（バスで約35分）の 標高 198メートルの山腹に位置する、 本州 最北端の空港である。","https://ja.wikipedia.org/wiki/青森空港","日本の空港","https://ja.wikipedia.org/wiki/日本の空港","箇条書き,制限あり","北緯40度44分00秒東経140度41分19秒","青森県青森市","商業","日本","青森県","198m(650ft)","06/24","7:30 - 22:00","青森空港管理事務所","","","","","","","","","","",""
"大島空港","[伊豆諸島：大島空港、新島空港、神津島空港、三宅島空港、八丈島空港] 伊豆大島北部の元町に位置する。滑走路は ジェット機 （小型）の離着陸にも対応している。","https://ja.wikipedia.org/wiki/大島空港","日本の空港","https://ja.wikipedia.org/wiki/日本の空港","箇条書き,制限あり","北緯34度46分55秒東経139度21分37秒","東京都大島町元町字北の山270番地","商業","日本","東京都港湾局","37.8m(124ft)","03/21","","大島空港","","","","","","大島町","","","","",""
"佐渡空港","[中部：佐渡空港、富山空港（富山きときと空港）、能登空港（のと里山空港）、福井空港、松本空港（信州まつもと空港）、静岡空港（富士山静岡空港）※2019年4月1日よりコンセッション方式で運営] 佐渡島北東部の 国仲平野 に位置し、佐渡市の中心部からは南西約4kmの地点にある。北方には標高1,172mの北金山を頂点とする大佐渡連峰、南方には標高645m級の小佐渡連山を眺望することができる。","https://ja.wikipedia.org/wiki/佐渡空港","日本の空港","https://ja.wikipedia.org/wiki/日本の空港","箇条書き,制限あり","北緯38度03分36秒東経138度24分50秒","新潟県佐渡市","商業","日本","新潟県","27m(88ft)","10/28","8:45 - 17:15","","","","","","","","","","","",""
"神戸空港","[近畿：神戸空港(マリンエア)※2018年4月1日よりコンセッション方式で運営、南紀白浜空港※2019年4月1日よりコンセッション方式で運営] 大阪市 の西約26キロメートル  、神戸市の中心部、 三宮 の南約8キロメートルに位置する 地方管理空港 。 関西国際空港 ・ 大阪国際空港 （伊丹空港）とともに、 関西三空港 のひとつに数えられる。海上都市 ポートアイランド の沖合約1キロメートルに造成された 人工島 の神戸空港島に建設され、 2006年 2月16日 に開港  。神戸市が設置・管理し、市営空港としては 旭川空港 ・ 帯広空港 に次いで国内3番目、旧 第三種空港 の中では、市が初めて建設から運営までを手がけた空港である。","https://ja.wikipedia.org/wiki/神戸空港","日本の空港","https://ja.wikipedia.org/wiki/日本の空港","箇条書き,制限あり","北緯34度37分58秒東経135度13分26秒","兵庫県神戸市中央区神戸空港","商業","日本","関西エアポート神戸","5.486m(18ft)","09/27","7:00 - 23:00","www.kairport.co.jpwww.kairport.co.jp/eng/index.html（英語）","156.5ha","2006年2月16日","","","","大阪市","","","","",""
"鳥取空港","[中国：鳥取空港（鳥取砂丘コナン空港）、隠岐空港（隠岐世界ジオパーク空港）、出雲空港（出雲縁結び空港）、石見空港（萩・石見空港）、岡山空港（岡山桃太郎空港）] 鳥取市中心部から北西約7kmの 日本海 、 千代川 、 湖山池 に囲まれた 砂丘 地帯に位置し  、主に鳥取県の東部の空運を担っている。空港法に基づく地方管理空港に区分され、鳥取県が設置・管理。定期旅客便は、国内線のみが発着する。","https://ja.wikipedia.org/wiki/鳥取空港","日本の空港","https://ja.wikipedia.org/wiki/日本の空港","箇条書き,制限あり","北緯35度31分48秒東経134度9分59秒","鳥取県鳥取市","商業","日本","鳥取県","14.7m","10/28","7:00 - 21:30","鳥取砂丘コナン空港","104.9ha","1967年7月31日","","","鳥取県","","","","","",""
"佐賀空港","[九州：佐賀空港（九州佐賀国際空港）、壱岐空港、対馬空港（対馬やまねこ空港）、小値賀空港、上五島空港、福江空港（五島つばき空港）] 佐賀県南部の 有明海 に面した干拓地に、 1998年 7月28日 に開港  。 旅客ターミナルビル の住所は佐賀県佐賀市川副町大字犬井道9476番地187。","https://ja.wikipedia.org/wiki/佐賀空港","日本の空港","https://ja.wikipedia.org/wiki/日本の空港","箇条書き,制限あり","北緯33度08分59秒東経130度18分08秒","佐賀県佐賀市川副町大字犬井道","商業","日本","佐賀県","2m(6ft)","11/29","06:30 - 22:0000:30 - 04:30","","","","","","","","","","","",""
"種子島空港","[薩南諸島：種子島空港（コスモポート種子島）、屋久島空港、奄美空港、喜界空港、徳之島空港（徳之島子宝空港）、沖永良部空港（えらぶゆりの島空港）、与論空港] 種子島のほぼ中央に位置する。約8km南西に位置した 旧種子島空港 は滑走路が1,500mと短いため プロペラ機 のみの就航であったが、新種子島空港の開港により、同県の離島空港の中で、 徳之島空港 、 奄美空港 に次いで、同港に ジェット機 （小型）の乗り入れが可能になった。","https://ja.wikipedia.org/wiki/種子島空港","日本の空港","https://ja.wikipedia.org/wiki/日本の空港","箇条書き,制限あり","北緯30度36分18秒東経130度59分30秒","鹿児島県熊毛郡中種子町増田2692番地64","商業","日本","鹿児島県","234m(768ft)","13/31","8:30 - 18:30","－","","","86,962人","114.4 t","","","1,835回","","","",""
"伊江島空港","[沖縄：伊江島空港、慶良間空港、粟国空港、久米島空港、北大東空港、南大東空港、宮古空港、下地島空港、多良間空港（かりゆす多良間空港）、新石垣空港（南ぬ島石垣空港） 、波照間空港、与那国空港] 1975年（昭和50年）7月に開催された 沖縄国際海洋博覧会 の関連事業として開港している  。伊江島の中心部あたりに設置されているが、元々は戦前、日本陸軍によって作られた「 伊江島東飛行場 」がベースとなっており、 第二次世界大戦 後の 連合国軍 （ アメリカ軍 ）の施設 占領 と返還を経て、再整備の上で新たにターミナルが建設された。","https://ja.wikipedia.org/wiki/伊江島空港","日本の空港","https://ja.wikipedia.org/wiki/日本の空港","箇条書き,制限あり","北緯26度43分21秒東経127度47分13秒","沖縄県国頭郡伊江村字東江上3992-2","商業","日本","沖縄県","72.5m(237.9ft)","04/22","12:15 - 16:45（土曜日）9:15 - 16:45（日曜日）","-","","","","","","","","","","",""
"調布飛行場","[関東：調布飛行場] 調布飛行場 （ちょうふひこうじょう、Chofu Airport）は、 東京都 調布市 （一部 三鷹市 ・ 府中市 にまたがる）にある 日本の飛行場 である。東京都営空港の一つ。正式名称は 東京都調布飛行場  。 調布空港 と呼ばれることもある。","https://ja.wikipedia.org/wiki/調布飛行場","日本の空港","https://ja.wikipedia.org/wiki/日本の空港","箇条書き,制限あり","北緯35度40分18秒東経139度31分41秒","東京都調布市","その他の空港","日本","東京都港湾局","42.3m(138.8ft)","17/35","","www.kouwan.metro.tokyo.lg.jp/rito/tmg-airport/chofu/","","","","","","","","","","",""
"名古屋飛行場","[中部：名古屋飛行場（名古屋空港、小牧空港、県営名古屋空港）] 名古屋市 の中心から北へおよそ15 kmの 濃尾平野 北東部に位置しており、行政区分上では 西春日井郡 豊山町 、 小牧市 、 春日井市 、 名古屋市 （ 北区 ）の3市1町にまたがっている。 航空自衛隊 小牧基地 に隣接しており、滑走路を共有しているが、防衛省設置管理の共用飛行場ではなく 愛知県 が管理する。 管制 業務は、 飛行場管制 業務と 着陸誘導管制 業務を 航空自衛隊 小牧管制隊が実施しており、 進入管制業務とターミナルレーダー管制業務 については、 中部国際空港 （常滑市）にある 国土交通省 大阪航空局 中部空港事務所が広域管制によって実施している。","https://ja.wikipedia.org/wiki/名古屋飛行場","日本の空港","https://ja.wikipedia.org/wiki/日本の空港","箇条書き,制限あり","北緯35度15分18秒東経136度55分28秒","愛知県西春日井郡豊山町、小牧市、春日井市、名古屋市","公共","日本","愛知県","14m(45.9ft)","16/34","7:00 - 22:00","県営名古屋空港","","","","","","名古屋市","","","","",""
"八尾空港","[近畿：八尾空港、但馬飛行場（コウノトリ但馬空港）] 大阪市 の 南東 約14km  にある 空港 。定期便の就航はなく、主として航空宣伝・写真測量・操縦訓練などの事業用や自家用の 小型航空機 や ヘリコプター の発着に利用されているほか、 陸上自衛隊 や 消防 ・ 警察 の航空隊が利用している。","https://ja.wikipedia.org/wiki/八尾空港","日本の空港","https://ja.wikipedia.org/wiki/日本の空港","箇条書き,制限あり","北緯34度35分46秒東経135度36分10秒","大阪府八尾市","その他","日本","国土交通大臣","10m","09/27","8:00 - 19:30","八尾空港","69.7ha","","","","","","","","","",""
