"利尻空港","[利尻空港〔利尻郡利尻富士町〕] 利尻空港は 利尻島 北端に位置する北海道内の最初の 離島 空港である。ジェット機の就航が可能であり、地域経済の活性化及び地域振興、島民の重要な生活基盤施設として期待されている。","https://ja.wikipedia.org/wiki/利尻空港","日本の空港","https://ja.wikipedia.org/wiki/日本の空港","箇条書き,制限あり","北緯45度14分23秒東経141度11分29秒","北海道利尻郡利尻富士町","商業","日本","北海道","30.7m(100.7ft)","07/25","9:00 - 17:00","","","","","","","","","","","",""
"礼文空港","[礼文空港〔礼文郡礼文町〕※2014年12月15日より2021年3月31日までの予定で供用休止中である。] 空港の建物は塗装の剥がれなど劣化がみられるものの、礼文町は航空路線の再開を希望しており、 北海道庁 が年間400万円を支出して維持管理しており、冬季は駐機場の 除雪 も行われている  。 気象庁 航空地方気象台による、航空気象観測所が空港内に設置されている。","https://ja.wikipedia.org/wiki/礼文空港","日本の空港","https://ja.wikipedia.org/wiki/日本の空港","箇条書き,制限あり","北緯45度27分18秒東経141度02分21秒","北海道礼文郡礼文町","商業","日本","北海道","27.3m(89.6ft)","14/32","休止中","","","","","","","","","","","",""
"函館空港","[函館空港〔函館市〕] 道南 の 政治 ・ 経済 ・ 文化 の中心地であり 観光 資源にも恵まれた函館市の中心部から約9km（バスで約20分）東方の海岸沿いの 丘陵 に位置している。函館の 奥座敷 である 湯の川温泉 からはわずかに4.5kmの利便性の高い空港である。また函館空港は北海道最南端の空港でもある。 海上保安庁 函館航空基地を併設する。","https://ja.wikipedia.org/wiki/函館空港","日本の空港","https://ja.wikipedia.org/wiki/日本の空港","箇条書き,制限あり","北緯41度46分12秒東経140度49分19秒","北海道函館市","商業","日本","北海道エアポート","34.1m","12/30","7:30 - 20:30","函館空港","164ha","","","","","","","","","",""
"奥尻空港","[奥尻空港〔奥尻郡奥尻町〕] 奥尻空港は、 奥尻島 の南部に位置する 離島 空港であり、また北海道最西端の空港でもある。 北海道南西沖地震 で街ごと大津波に襲われた青苗地区の近くに位置する。奥尻島の空の玄関口として 観光 を中心とした 地域振興 を支える拠点の一つとしての役割が期待されている。","https://ja.wikipedia.org/wiki/奥尻空港","日本の空港","https://ja.wikipedia.org/wiki/日本の空港","箇条書き,制限あり","北緯42度04分23秒東経139度25分45秒","北海道奥尻郡奥尻町","商業","日本","北海道","52.1m(170.9ft)","13/31","9:00 - 17:00","奥尻町","","","","","","","","","","",""
"釧路空港","[釧路空港（たんちょう釧路空港）〔釧路市〕] 釧路市中心部より北西に約20km離れた丘陵上に位置する。近隣に 釧路湿原国立公園 と 阿寒摩周国立公園 を擁し、 道東 の拠点空港として重要な役割を担っている。","https://ja.wikipedia.org/wiki/釧路空港","日本の空港","https://ja.wikipedia.org/wiki/日本の空港","箇条書き,制限あり","北緯43度02分27秒東経144度11分34秒","北海道釧路市","商業","日本","北海道エアポート","95m(311ft)","17/35","8:00 - 21:00","釧路空港","160ha","1961年","775,019人","2,577t","","","","","","",""
"中標津空港","[中標津空港（根室中標津空港）〔標津郡中標津町〕] 定期路線を就航している 全日空 グループでは 根室中標津空港 （ねむろなかしべつくうこう、 英 : Nemuro-Nakashibetsu Airport ）の名称を使用し、空港ビル運営会社名も根室中標津空港ビル株式会社である。","https://ja.wikipedia.org/wiki/中標津空港","日本の空港","https://ja.wikipedia.org/wiki/日本の空港","箇条書き,制限あり","北緯43度34分39秒東経144度57分36秒","北海道標津郡中標津町","商業","日本","北海道","65.2m(213.9ft)","08/26","8:30 - 18:30","根室中標津空港","","","","","","根室市","","","","",""
"女満別空港","[女満別空港〔網走郡大空町〕] オホーツク海 沿岸の 網走市 中心部から南西に約22km（バスで約30分）に位置する オホーツク総合振興局 の主要空港である。近傍には網走市と 北見市 を結ぶ 国道39号 が走る。空港周辺地域には 知床国立公園 、 阿寒摩周国立公園 や 網走国定公園 などが存在する。空港が位置する 女満別町 は2006年に 東藻琴村 と合併して 大空町 となったが、空港の名称は変更されなかった。","https://ja.wikipedia.org/wiki/女満別空港","日本の空港","https://ja.wikipedia.org/wiki/日本の空港","箇条書き,制限あり","北緯43度52分50秒東経144度09分51秒","北海道網走郡大空町女満別中央","商用","日本","北海道エアポート","33.1m(108ft)","18/36","8:00 - 21:00","女満別空港","166.7ha","","736,169人","1,880t","","","","","","",""
"紋別空港","[紋別空港（オホーツク紋別空港）〔紋別市〕] 紋別空港 （もんべつくうこう、Monbetsu Airport）は、 北海道 紋別市 にある 地方管理空港（旧: 第三種空港） である。愛称は オホーツク紋別空港 （オホーツクもんべつくうこう Okhotsk-Monbetsu Airport ）。","https://ja.wikipedia.org/wiki/紋別空港","日本の空港","https://ja.wikipedia.org/wiki/日本の空港","箇条書き,制限あり","北緯44度18分15秒東経143度24分29秒","北海道紋別市","商業","日本","北海道","17.8m(58.4ft)","14/32","9:00 - 17:00 (JST)","","","","","","","","","","","",""
"帯広空港","[帯広空港（とかち帯広空港）〔帯広市〕] 十勝平野 の中心都市である帯広市の中心部から南に約25 km、 太平洋 岸から約30 km 内陸の畑作地帯（同平野のほぼ中央部）に位置し、西には 日高山脈 、北には 大雪山 系が広がる。 滑走路 は17/35方向に延長2,500 mのものが設置されているほか、 平行誘導路 および幅 300 m の 着陸帯 を有する。計器着陸に対応しており、 計器着陸装置 (ILS) は滑走路35側にカテゴリーI が設置されている。 エプロン には大型ジェット機用2バース、小型ジェット機用2バースがあり、他に小型機用のスポットも有する。なお、 ボーディングブリッジ は3基を備えている。","https://ja.wikipedia.org/wiki/帯広空港","日本の空港","https://ja.wikipedia.org/wiki/日本の空港","箇条書き,制限あり","北緯42度44分0秒東経143度13分2秒","北海道帯広市","商業","日本","北海道エアポート","149.25m(490ft)","17/35","8 : 00 - 21 : 00","帯広空港ターミナルビル","282ha","1964年12月1日","","","","","","","","",""
"青森空港","[青森空港〔青森県青森市〕] 青森市中心部から南方に約10キロメートル（バスで約35分）の 標高 198メートルの山腹に位置する、 本州 最北端の空港である。","https://ja.wikipedia.org/wiki/青森空港","日本の空港","https://ja.wikipedia.org/wiki/日本の空港","箇条書き,制限あり","北緯40度44分00秒東経140度41分19秒","青森県青森市","商業","日本","青森県","198m(650ft)","06/24","7:30 - 22:00","青森空港管理事務所","","","","","","","","","","",""
"三沢飛行場","[三沢飛行場（三沢空港）〔青森県三沢市〕] 三沢飛行場（三沢空港）は、青森県の太平洋岸東南部にある三沢市の市街地の外れ、市域のほぼ中央に位置し（三沢市中央部までバスで約15分）、青森県東部の玄関口となる空港であり、また本州の空港としては最東端に位置する。","https://ja.wikipedia.org/wiki/三沢飛行場","日本の空港","https://ja.wikipedia.org/wiki/日本の空港","箇条書き,制限あり","北緯40度42分19秒東経141度22分19秒","青森県三沢市大字三沢字下タ沢83番地198","軍民共用","日本","アメリカ空軍","36m(119ft)","10/28","","航空自衛隊 三沢基地三沢空港ターミナル","","","","","防衛省","","","アメリカ空軍第35戦闘航空団航空自衛隊第3航空団","1941年","",""
"花巻空港","[花巻空港（いわて花巻空港）〔岩手県花巻市〕] 花巻空港 （はなまきくうこう）は、 岩手県 花巻市 にある 地方管理空港 である。 いわて花巻空港 の愛称がある。面積は1,722,278m 2 。","https://ja.wikipedia.org/wiki/花巻空港","日本の空港","https://ja.wikipedia.org/wiki/日本の空港","箇条書き,制限あり","北緯39度25分43秒東経141度08分07秒","岩手県花巻市","商業","日本","岩手県","91m(297ft)","02/20","8:00 - 19:30","花巻空港","","","","","","","","","","",""
"仙台空港","[仙台空港（仙台国際空港）〔宮城県名取市〕] 仙台空港 （せんだいくうこう）は、 宮城県 名取市 と 岩沼市 に跨って位置する 東北地方 唯一の 国管理空港 （旧第二種(A)空港）である  。 2016年 7月1日 に運営が 仙台国際空港株式会社 に移管（民営化）された  。 空港ターミナルビル が名取市にあり、 滑走路 が岩沼市に及ぶ。愛称は 仙台国際空港  。","https://ja.wikipedia.org/wiki/仙台空港","日本の空港","https://ja.wikipedia.org/wiki/日本の空港","箇条書き,制限あり","北緯38度08分13秒東経140度55分21秒","宮城県名取市・岩沼市","商業","日本","仙台国際空港株式会社","5m(16.4ft)","12/30","7:30 - 21:30","仙台空港ターミナル","","","","","","仙台市","","","","",""
"秋田空港","[秋田空港〔秋田県秋田市〕] 1981年 （昭和56年）6月26日に開港  。秋田市中心部から南東に約20kmの 河辺郡 雄和町 （現・秋田市）の 雄物川 と 岩見川 に挟まれた 安養寺川 上流の 丘陵地  に位置する。 東北地方 では最も早く2,500m 滑走路 を整備した空港であった。","https://ja.wikipedia.org/wiki/秋田空港","日本の空港","https://ja.wikipedia.org/wiki/日本の空港","箇条書き,制限あり","北緯39度36分56秒東経140度13分07秒","秋田県秋田市雄和椿川","商業","日本","秋田県","93.1m(305ft)","10/28","7:00 - 22:00","秋田空港","159ha","1981年6月26日","1,228,136人","2,009t","","","","","","",""
"大館能代空港","[大館能代空港（あきた北空港）〔秋田県北秋田市〕] 愛称は あきた北空港 であるが、愛称の使用範囲は限定的である   。また、ターミナルビルや駐車場などの施設は 道の駅大館能代空港 と兼用になっている。","https://ja.wikipedia.org/wiki/大館能代空港","日本の空港","https://ja.wikipedia.org/wiki/日本の空港","箇条書き,制限あり","北緯40度11分31秒東経140度22分18秒","秋田県北秋田市","商業","日本","秋田県","89m(292ft)","11/29","8:00 - 19:30","大館能代空港","","","","","","","","","","",""
"山形空港","[山形空港（おいしい山形空港）〔山形県東根市〕] 南北に長い 山形盆地 の中北部、 最上川 右岸（東岸）にあり、南北方向の 滑走路 を擁する。滑走路東側に沿うように 国道13号 や JR 山形新幹線 ・ 奥羽本線 （愛称 山形線 ）が並走しており、 県庁所在地 の 山形市 から北に約20 km の距離にある。最寄 IC は、 東北中央自動車道 ・ 東根IC 。","https://ja.wikipedia.org/wiki/山形空港","日本の空港","https://ja.wikipedia.org/wiki/日本の空港","箇条書き,制限あり","北緯38度24分42秒東経140度22分16秒","山形県東根市","商業","日本","山形県","105.2m(345ft)","01/19","8:00 - 20:00","山形空港","91ha","1964年","355,242人","","","","","","","",""
"庄内空港","[庄内空港（おいしい庄内空港）〔山形県酒田市・鶴岡市〕] 1970年 代前後から、全国的に高速交通時代を迎えたが、庄内地方はそれに取り残されたため、空港設置を望む声が上がった。そうした要望を踏まえ地元自治体で組織される庄内開発協議会は、1970年7月、庄内空港建設を提唱した。また県も庄内空港建設調査会を設置。同調査会は『山形県庄内空港整備計画』を策定し、庄内地域の経済発展と情報格差是正に庄内空港の必要性を強調するとともに ジェット機 空港の建設を提言した  。これを受け県は、庄内空港建設を県の重要開発事業として定め、国への働きかけを開始した。しかし、整備計画で建設予定地として提示された 三川町 において「庄内の美田をつぶすな」との声が起こり、建設推進の動きは止まってしまった   。","https://ja.wikipedia.org/wiki/庄内空港","日本の空港","https://ja.wikipedia.org/wiki/日本の空港","箇条書き,制限あり","北緯38度48分44秒東経139度47分14秒","山形県酒田市","商業","日本","山形県","26m(86ft)","09/27","7:00 - 22:00","庄内空港","","","","","","","","","","",""
"福島空港","[福島空港〔福島県石川郡玉川村〕] 郡山市 の南東約20kmにある、 須賀川市 ・ 石川郡 玉川村 にまたがる阿武隈山系の丘陵地帯を開削し、1993年（平成5年）に県管理の第三種空港として開港した。その後、平行誘導路の設置、滑走路の延長を経て、2000年（平成12年）に全面供用となっている。","https://ja.wikipedia.org/wiki/福島空港","日本の空港","https://ja.wikipedia.org/wiki/日本の空港","箇条書き,制限あり","北緯37度13分39秒東経140度25分41秒","福島県石川郡玉川村","商業","日本","福島県","372m(1,221ft)","01/19","8:05 - 20:30","福島空港","","","","","","","","","","",""
"百里飛行場","[百里飛行場（茨城空港）〔茨城県小美玉市〕] 百里飛行場 （ひゃくりひこうじょう）は、 茨城県 小美玉市 百里 ・与沢にある自衛隊と民間の共用 飛行場 である。","https://ja.wikipedia.org/wiki/百里飛行場","日本の空港","https://ja.wikipedia.org/wiki/日本の空港","箇条書き,制限あり","北緯36度11分00秒東経140度25分14秒","茨城県小美玉市百里・与沢","軍民共用","日本","航空自衛隊","32m(105ft)","03R/21L","24時間","百里基地茨城空港","","","","","防衛省","","","中部航空方面隊第7航空団航空救難団百里救難隊","","",""
"成田国際空港","[成田国際空港（成田空港）〔千葉県成田市〕] 東京国際空港 とともに 首都圏 の「空の玄関」である。","https://ja.wikipedia.org/wiki/成田国際空港","日本の空港","https://ja.wikipedia.org/wiki/日本の空港","箇条書き,制限あり","北緯35度45分55秒東経140度23分08秒","千葉県成田市・山武郡芝山町・香取郡多古町","民間、商業","日本","成田国際空港株式会社","43m(141ft)","16R/34L","6:00 - 24:00","https://www.narita-airport.jp/jp/","1,137ha","1978年5月20日","44,344,739人","2,039,905t","成田国際空港株式会社（日本国政府出資）","東京","264,115回","","","",""
"東京国際空港","[東京国際空港（羽田空港）〔東京都大田区〕] 成田国際空港 と並ぶ、 首都圏 の「空の玄関」である  。2019年の乗降客数は、世界5位となった  。","https://ja.wikipedia.org/wiki/東京国際空港","日本の空港","https://ja.wikipedia.org/wiki/日本の空港","箇条書き,制限あり","北緯35度33分12秒東経139度46分52秒","東京都大田区羽田空港","公共","日本","国土交通大臣","6.4m(21ft)","16R/34L","24時間","tokyo-haneda.com","1,516ha","1931年8月25日 (89年前) (1931-08-25)","84,893,742","1,271,143t","国土交通省","東京","","","","",""
"調布飛行場","[調布飛行場〔東京都調布市〕] 調布飛行場 （ちょうふひこうじょう、Chofu Airport）は、 東京都 調布市 （一部 三鷹市 ・ 府中市 にまたがる）にある 日本の飛行場 である。東京都営空港の一つ。正式名称は 東京都調布飛行場  。 調布空港 と呼ばれることもある。","https://ja.wikipedia.org/wiki/調布飛行場","日本の空港","https://ja.wikipedia.org/wiki/日本の空港","箇条書き,制限あり","北緯35度40分18秒東経139度31分41秒","東京都調布市","その他の空港","日本","東京都港湾局","42.3m(138.8ft)","17/35","","www.kouwan.metro.tokyo.lg.jp/rito/tmg-airport/chofu/","","","","","","","","","","",""
"大島空港","[大島空港〔東京都大島町〕] 伊豆大島北部の元町に位置する。滑走路は ジェット機 （小型）の離着陸にも対応している。","https://ja.wikipedia.org/wiki/大島空港","日本の空港","https://ja.wikipedia.org/wiki/日本の空港","箇条書き,制限あり","北緯34度46分55秒東経139度21分37秒","東京都大島町元町字北の山270番地","商業","日本","東京都港湾局","37.8m(124ft)","03/21","","大島空港","","","","","","大島町","","","","",""
"新島空港","[新島空港〔東京都新島村〕] 新島空港 （にいじまくうこう、Niijima Airport）は、 東京都 新島村 （ 新島 ）にある 空港 。東京都営空港の一つ。 空港法 の分類では 地方管理空港 （旧 空港整備法 の分類では 第三種空港 ）。","https://ja.wikipedia.org/wiki/新島空港","日本の空港","https://ja.wikipedia.org/wiki/日本の空港","箇条書き,制限あり","北緯34度22分10秒東経139度16分06秒","東京都新島村","商業","日本","東京都港湾局","28.6m(93.8ft)","11/29","","新島空港","","","","","","","","","","",""
"神津島空港","[神津島空港〔東京都神津島村〕] 神津島空港 （こうづしまくうこう、Kouzushima Airport）は、 東京都 神津島村 （ 神津島 ）に所在する 地方管理空港 である。","https://ja.wikipedia.org/wiki/神津島空港","日本の空港","https://ja.wikipedia.org/wiki/日本の空港","箇条書き,制限あり","北緯34度11分10秒東経139度08分12秒","東京都神津島村","商業","日本","東京都港湾局","138.4m(454.1ft)","11/29","","神津島空港","","","","","","","","","","",""
"三宅島空港","[三宅島空港〔東京都三宅村〕] 三宅島空港 （みやけじまくうこう Miyakejima Airport ）は、 東京都 三宅村 （ 三宅島 ）にあり、東京都港湾局が運営する 地方管理空港 。","https://ja.wikipedia.org/wiki/三宅島空港","日本の空港","https://ja.wikipedia.org/wiki/日本の空港","箇条書き,制限あり","北緯34度04分25秒東経139度33分37秒","東京都三宅村","商業","日本","東京都港湾局","19.9m(65.3ft)","02/20","","三宅島空港","","","","","","","","","","",""
"八丈島空港","[八丈島空港〔東京都八丈町〕] 1927年（昭和2年）に旧海軍飛行場として誕生。戦後、八丈島三根出身の実業家、小宮山源一が、旧海軍の飛行場に更に400mを増強、1954年（昭和29年）に運営は村営とした。1962年（昭和37年）、滑走路1,200ｍで供用開始  。 《1972年（昭和47年）、1500mに延長　1982年（昭和57年）、1800mに延長　2004年（平成16年）、2000mに延長》","https://ja.wikipedia.org/wiki/八丈島空港","日本の空港","https://ja.wikipedia.org/wiki/日本の空港","箇条書き,制限あり","北緯33度06分54秒東経139度47分09秒","東京都八丈町","商業","日本","東京都港湾局","92m(303ft)","08/26","8:00 - 18:00","八丈島空港ビル","","","","","","","","","","",""
"新潟空港","[新潟空港〔新潟県新潟市東区〕] 新潟空港 （にいがたくうこう）は、 新潟県 新潟市 東区 にある 国管理空港  。","https://ja.wikipedia.org/wiki/新潟空港","日本の空港","https://ja.wikipedia.org/wiki/日本の空港","箇条書き,制限あり","北緯37度57分21秒東経139度07分14秒","新潟県新潟市東区","商業","日本","国土交通大臣","9m(29ft)","04/22","7:30 - 21:30 (JST)","新潟空港","","","993,980人","454t","","","13,372","","","",""
"佐渡空港","[佐渡空港〔新潟県佐渡市〕※定期便は設定されていない。] 佐渡島北東部の 国仲平野 に位置し、佐渡市の中心部からは南西約4kmの地点にある。北方には標高1,172mの北金山を頂点とする大佐渡連峰、南方には標高645m級の小佐渡連山を眺望することができる。","https://ja.wikipedia.org/wiki/佐渡空港","日本の空港","https://ja.wikipedia.org/wiki/日本の空港","箇条書き,制限あり","北緯38度03分36秒東経138度24分50秒","新潟県佐渡市","商業","日本","新潟県","27m(88ft)","10/28","8:45 - 17:15","","","","","","","","","","","",""
"富山空港","[富山空港（富山きときと空港）〔富山県富山市〕] 富山県富山市中心部の南約7 キロメートル に位置する  。 立山黒部アルペンルート 、世界遺産 五箇山 に最も近い国際空港。富山市街地や 富山IC 、 国道41号 から近くアクセスの利便性が高いため、富山県民のみならず、近隣の 新潟県 上越地方  、 岐阜県 飛騨地方 などからも利用しやすい空港である。 制限表面 は外側水平表面（ 航空法 ：半径24km以下、高さ295m）や円錐表面（半径16.5km以下）が設定されておらず、水平表面（半径4km以下、高さ45m）が半径3kmで設定されている  。このため、近接しながらも市街地でのビル建設には影響を与えていない。","https://ja.wikipedia.org/wiki/富山空港","日本の空港","https://ja.wikipedia.org/wiki/日本の空港","箇条書き,制限あり","北緯36度38分54秒東経137度11分15秒","富山県富山市","商業","日本","","23.6m(77ft)","02/20","7:00 - 21:30","富山きときと空港","","","","","","","","","","",""
"小松飛行場","[小松飛行場（小松空港）〔石川県小松市〕] この節には 複数の問題があります 。 改善 や ノートページ での議論にご協力ください。","https://ja.wikipedia.org/wiki/小松飛行場","日本の空港","https://ja.wikipedia.org/wiki/日本の空港","箇条書き,制限あり","北緯36度23分38秒東経136度24分27秒","石川県小松市","軍民共用","日本","航空自衛隊","6m(18ft)","06/24","","小松空港公式サイト航空自衛隊 小松基地","","","","","防衛省","金沢市・福井市","","第6航空団飛行教導群小松救難隊石川県消防防災航空隊","","",""
"能登空港","[能登空港（のと里山空港）〔石川県輪島市・鳳珠郡穴水町・鳳珠郡能登町〕] また、 空港ターミナルビル や駐車場などの施設を共用している 道の駅のと里山空港 についても本項で述べる。","https://ja.wikipedia.org/wiki/能登空港","日本の空港","https://ja.wikipedia.org/wiki/日本の空港","箇条書き,制限あり","北緯37度17分36秒東経136度57分44秒","石川県輪島市","商業","日本","石川県","219m(720ft)","07/25","8:00 - 19:30","https://www.noto-airport.jp/","","","","","","","","","","",""
"福井空港","[福井空港〔福井県坂井市〕 ※定期便は設定されていない。] 福井空港 （ふくいくうこう、 英語 :Fukui Airport）は、 福井県 坂井市 春江町 江留中にある 地方管理空港 である。","https://ja.wikipedia.org/wiki/福井空港","日本の空港","https://ja.wikipedia.org/wiki/日本の空港","箇条書き,制限あり","北緯36度8分34秒東経136度13分26秒","福井県坂井市","商業","日本","福井県","5.4m(18ft)","18/36","9:00 - 17:00","福井空港事務所","","1966年","","","","","","","","",""
"松本空港","[松本空港（信州まつもと空港）〔長野県松本市・塩尻市〕] 長野県のほぼ中央、松本市中心部から南西約9キロメートル、塩尻市中心部から北西約6キロメートルに位置する。 空港法 第5条第1項に基づく地方管理空港で、長野県が設置・管理している   。定期便は国内線のみで、国際線は就航していない。日本の空港の中で最も 標高 の高い場所（657.5m）にある   ため、平地の空港よりも、就航できる機材や就航先が制約される状況にある。また、高い山岳に囲まれていることにより 計器着陸装置 （ILS）の効果がないため、日本の1,500m以上の 滑走路 を持つ ジェット 化空港としては唯一設置されていない。 パイロット は目視のみで着陸するため「日本一着陸の難しい空港」とも言われる  。日本の空港では唯一の、 内陸 県に位置する空港である  。","https://ja.wikipedia.org/wiki/松本空港","日本の空港","https://ja.wikipedia.org/wiki/日本の空港","箇条書き,制限あり","北緯36度10分0秒東経137度55分22秒","長野県松本市・塩尻市","商業","日本","長野県","657.5m(2157.2ft)","18/36","8:30 - 17:00","http://www.matsumoto-airport.co.jp/","59ha","1965年7月16日","","","","","","","","",""
