"タイトル","コメント","URL","親リストタイトル","親リストURL","一覧抽出方法","座標","所在地","標高","通過路","山系","位置","国","種類","教派","献堂日","地方","団体コード","ISO 3166-2:JP","面積","総人口","人口密度","隣接都道府県","県の木","県の花","県の鳥"
"石北峠","[1石北峠せきほく北海道上川郡上川町・北見市] 石北峠 （せきほくとうげ）は、 北海道 の 上川郡 上川町 と 北見市 （旧 留辺蘂町 ）の境にある 国道39号 の 峠 。","https://ja.wikipedia.org/wiki/石北峠","日本百名峠","https://ja.wikipedia.org/wiki/日本百名峠","表形式","北緯43度38分54秒東経143度09分32秒","北海道上川郡上川町・北見市","1,050m","国道39号","石狩山地","","","","","","","","","","","","","","",""
"美幌峠","[2美幌峠びほろ北海道網走郡美幌町・川上郡弟子屈町] 美幌峠 （びほろとうげ）は、 北海道 網走郡 美幌町 と 川上郡 弟子屈町 の境にある 国道243号 の 峠 。 オホーツク総合振興局 と 釧路総合振興局 の境界にもなっている。","https://ja.wikipedia.org/wiki/美幌峠","日本百名峠","https://ja.wikipedia.org/wiki/日本百名峠","表形式","北緯43度38分55秒東経144度14分53秒","日本北海道網走郡美幌町・川上郡弟子屈町","493m","国道243号","屈斜路カルデラ外輪山","","","","","","","","","","","","","","",""
"狩勝峠","[3狩勝峠かりかち北海道空知郡南富良野町・上川郡新得町] 狩勝峠 （かりかちとうげ）とは、 北海道 空知郡 南富良野町 と 上川郡 新得町 の境界にある 峠 。道路の峠の標高は644m。峠の西側は 石狩川 水系、東側は 十勝川 水系で、 日本海 側と 太平洋 側の 分水界 である。","https://ja.wikipedia.org/wiki/狩勝峠","日本百名峠","https://ja.wikipedia.org/wiki/日本百名峠","表形式","北緯43度8分7.6秒東経142度45分52秒","北海道空知郡南富良野町・上川郡新得町","644m","根室本線（新狩勝トンネル）国道38号道東自動車道（狩勝第一トンネル）","日高山脈","","","","","","","","","","","","","","",""
"発荷峠","[4発荷峠はっか秋田県鹿角市・鹿角郡小坂町] 発荷峠 （はっかとうげ）は、 秋田県 鹿角市 と 秋田県 小坂町 の境にある 峠 。標高 631m","https://ja.wikipedia.org/wiki/発荷峠","日本百名峠","https://ja.wikipedia.org/wiki/日本百名峠","表形式","北緯40度24分30.31秒東経140度51分51.17秒","秋田県鹿角市・小坂町","631m","国道103号","奥羽山脈","","","","","","","","","","","","","","",""
"矢立峠","[5矢立峠やたて青森県平川市・秋田県大館市] 矢立峠 （やたてとうげ）は、 秋田県 大館市 と 青森県 平川市 の 県境 にある 峠 である。標高は258m。","https://ja.wikipedia.org/wiki/矢立峠","日本百名峠","https://ja.wikipedia.org/wiki/日本百名峠","表形式","北緯40度25分16秒東経140度37分35秒","秋田県大館市・青森県平川市","258m","国道7号奥羽本線（矢立トンネル）","奥羽山脈","","","","","","","","","","","","","","",""
"八幡平","[6八幡平はちまんたい岩手県八幡平市・秋田県鹿角市・仙北市] 八幡平 （はちまんたい）は、 秋田県 と 岩手県 にまたがる 標高 1,614 m の山及びその周囲の高原台地  。 深田久弥 の 日本百名山 に挙げられている   。山域は 1956年 （昭和31年）に 十和田八幡平国立公園 に指定されている。","https://ja.wikipedia.org/wiki/八幡平","日本百名峠","https://ja.wikipedia.org/wiki/日本百名峠","表形式","北緯39度57分28秒東経140度51分15秒","日本岩手県八幡平市秋田県仙北市・鹿角市","1,613.50m","","奥羽山脈","北緯39度57分28秒東経140度51分15秒﻿ / ﻿北緯39.95778度 東経140.85417度﻿ /39.95778; 140.85417座標:北緯39度57分28秒東経140度51分15秒﻿ / ﻿北緯39.95778度 東経140.85417度﻿ /39.95778; 140.85417","","成層火山","","","","","","","","","","","",""
"国見峠 (岩手県・秋田県)","[7国見峠くにみ岩手県岩手郡雫石町・秋田県仙北市] 国見峠 （くにみとうげ）は、 岩手県 岩手郡 雫石町 と 秋田県 仙北市 を結ぶ 奥羽山脈 上の 峠 である。 笹森山 の南稜線上にあり、標高は940m  。","https://ja.wikipedia.org/wiki/国見峠_(岩手県・秋田県)","日本百名峠","https://ja.wikipedia.org/wiki/日本百名峠","表形式","北緯39度43分11秒東経140度47分18秒","岩手県岩手郡雫石町・秋田県仙北市","940m","","奥羽山脈","","","","","","","","","","","","","","",""
"笛吹峠 (岩手県)","[8笛吹峠ふえふき岩手県遠野市・釜石市] 笛吹峠 （ふえふきとうげ）は 岩手県 遠野市 と同 釜石市 を結ぶ 岩手県道35号釜石遠野線 の峠。標高は867m。","https://ja.wikipedia.org/wiki/笛吹峠_(岩手県)","日本百名峠","https://ja.wikipedia.org/wiki/日本百名峠","表形式","北緯39度20分39秒東経141度39分36秒","岩手県遠野市・釜石市","867m","岩手県道35号釜石遠野線","北上山地","","","","","","","","","","","","","","",""
"五輪峠 (岩手県)","[9五輪峠ごりん岩手県花巻市・遠野市・奥州市] 五輪峠 （ごりんとうげ）は、 岩手県 花巻市 、同県 遠野市 、 奥州市 の境界となっている峠。 岩手県道174号小友米里線 が経由している。標高は556m。","https://ja.wikipedia.org/wiki/五輪峠_(岩手県)","日本百名峠","https://ja.wikipedia.org/wiki/日本百名峠","表形式","北緯39度15分37秒東経141度21分25秒","岩手県花巻市・遠野市・奥州市","556m","岩手県道174号小友米里線","北上山地","","","","","","","","","","","","","","",""
"仙人峠 (岩手県)","[10仙人峠せんにん岩手県遠野市・釜石市] 仙人峠 （せんにんとうげ）は、 岩手県 遠野市 と 釜石市 の境界の 北上山地 中にある標高887 メートルの 峠 である。 北上川 支流の 猿ヶ石川 の支流 早瀬川 と、 甲子川 の 分水界 となっている。","https://ja.wikipedia.org/wiki/仙人峠_(岩手県)","日本百名峠","https://ja.wikipedia.org/wiki/日本百名峠","表形式","北緯39度16分35秒東経141度41分49秒","岩手県遠野市・釜石市","887m","国道283号仙人峠道路（新仙人トンネル）国道283号（仙人トンネル）釜石線","北上山地","","","","","","","","","","","","","","",""
"花立峠 (山形県・宮城県)","[11花立峠はなだて山形県最上郡最上町・宮城県大崎市] 花立峠 （はなだてとうげ）は、 山形県 最上郡 最上町 と 宮城県 大崎市 を結ぶ 峠 である。標高796m。","https://ja.wikipedia.org/wiki/花立峠_(山形県・宮城県)","日本百名峠","https://ja.wikipedia.org/wiki/日本百名峠","表形式","北緯38度47分26秒東経140度36分2秒","山形県最上郡最上町・宮城県大崎市","796m","山形県道・宮城県道63号最上鬼首線","奥羽山脈","","","","","","","","","","","","","","",""
"山刀伐峠","[12山刀伐峠なたぎり山形県最上郡最上町・尾花沢市] 山刀伐峠 （なたぎりとうげ）とは、 山形県 最上郡 最上町 と 尾花沢市 を結ぶ 峠 である。標高390m。","https://ja.wikipedia.org/wiki/山刀伐峠","日本百名峠","https://ja.wikipedia.org/wiki/日本百名峠","表形式","北緯38度41分25秒東経140度31分42秒","山形県最上郡最上町・尾花沢市","390m","山形県道28号尾花沢最上線（山刀伐トンネル）","奥羽山脈","","","","","","","","","","","","","","",""
"板谷峠","[13板谷峠いたや山形県米沢市・福島県福島市] 板谷峠 （いたやとうげ）は、 山形県 南部の 吾妻山 北麓にある、 奥羽山脈 を越える山形県・ 福島県 境近くの 峠 のことである。標高は755  m で、 米沢藩 の 参勤交代 路としても使われていた。","https://ja.wikipedia.org/wiki/板谷峠","日本百名峠","https://ja.wikipedia.org/wiki/日本百名峠","表形式","北緯37度48分34.5秒東経140度15分2.9秒","山形県米沢市","755m","山形県道232号板谷米沢停車場線山形新幹線・奥羽本線（板谷トンネル）","奥羽山脈","","","","","","","","","","","","","","",""
"笹谷峠","[14笹谷峠ささや宮城県柴田郡川崎町・山形県山形市] 笹谷峠 （ささやとうげ）は、 宮城県 と 山形県 とを結ぶ最古の 峠 である。標高906m。","https://ja.wikipedia.org/wiki/笹谷峠","日本百名峠","https://ja.wikipedia.org/wiki/日本百名峠","表形式","北緯38度13分41秒東経140度28分10秒","宮城県柴田郡川崎町・山形県山形市","906m","国道286号山形自動車道（笹谷トンネル）","蔵王連峰","","","","","","","","","","","","","","",""
"苅田峠 (存在しないページ)","[15苅田峠かった宮城県刈田郡蔵王町・七ヶ宿町・山形県上山市]","https://ja.wikipedia.org/w/index.php?title=苅田峠&amp;action=edit&amp;redlink=1","日本百名峠","https://ja.wikipedia.org/wiki/日本百名峠","表形式","","","","","","","","","","","","","","","","","","","",""
"金山峠 (山形県・宮城県)","[16金山峠かねやま宮城県刈田郡七ヶ宿町・山形県上山市] 金山峠 （かねやまとうげ）は、 山形県 上山市 と 宮城県 刈田郡 七ヶ宿町 を結ぶ 峠 である。標高623m。","https://ja.wikipedia.org/wiki/金山峠_(山形県・宮城県)","日本百名峠","https://ja.wikipedia.org/wiki/日本百名峠","表形式","北緯38度3分24.8秒東経140度17分50.4秒","山形県上山市・宮城県刈田郡七ヶ宿町","623m","山形県道・宮城県道13号上山七ヶ宿線","奥羽山脈","","","","","","","","","","","","","","",""
"大内峠","[17大内峠おおうち福島県大沼郡会津美里町・会津若松市・南会津郡下郷町] 大内峠 （おおうちとうげ）は、 福島県 会津若松市 と同県 南会津郡 下郷町 の境界にある峠。峠の南側には、古くの 宿場 の雰囲気を残し、 茅葺き の民家などが残る 大内宿 が存在する。","https://ja.wikipedia.org/wiki/大内峠","日本百名峠","https://ja.wikipedia.org/wiki/日本百名峠","表形式","北緯37度21分26秒東経139度52分49秒","福島県会津若松市・南会津郡下郷町","899m","福島県道131号下郷会津本郷線","奥羽山脈","","","","","","","","","","","","","","",""
"六十里越","[18六十里越ろくじゅうりごえ福島県南会津郡只見町・新潟県魚沼市] 六十里越 （ろくじゅうりごえ）は、 新潟県 魚沼市 と 福島県 南会津郡 只見町 との間にある 峠 。","https://ja.wikipedia.org/wiki/六十里越","日本百名峠","https://ja.wikipedia.org/wiki/日本百名峠","表形式","北緯37度18分14秒東経139度12分52秒","新潟県魚沼市・福島県南会津郡只見町","863m","国道252号（六十里越トンネル）只見線（六十里越トンネル）","越後山脈","","","","","","","","","","","","","","",""
"金精峠","[19金精峠こんせい栃木県日光市・群馬県利根郡片品村] 金精峠 （こんせいとうげ）は、 栃木県 日光市 と 群馬県 利根郡 片品村 との境にある 標高 2024mの 峠 である。","https://ja.wikipedia.org/wiki/金精峠","日本百名峠","https://ja.wikipedia.org/wiki/日本百名峠","表形式","北緯36度49分08秒 東経139度23分42秒","日本栃木県日光市群馬県利根郡片品村","2,024m","国道120号","日光連山","","","","","","","","","","","","","","",""
"細尾峠","[20細尾峠ほそお栃木県日光市] 細尾峠 （ほそおとうげ）は、 栃木県 日光市 にある 峠 である。","https://ja.wikipedia.org/wiki/細尾峠","日本百名峠","https://ja.wikipedia.org/wiki/日本百名峠","表形式","北緯36度42分38秒東経139度30分51秒","日本栃木県日光市","1,197m","国道122号（日足トンネル）","足尾山地","","","","","","","","","","","","","","",""
"三国峠 (群馬県・新潟県)","[21三国峠みくに群馬県利根郡みなかみ町・新潟県南魚沼郡湯沢町] 三国峠 （みくにとうげ）は、 日本 の 新潟県 南魚沼郡 湯沢町 ・ 群馬県 利根郡 みなかみ町 の境（ 上越国境 ）を越える 峠 である。","https://ja.wikipedia.org/wiki/三国峠_(群馬県・新潟県)","日本百名峠","https://ja.wikipedia.org/wiki/日本百名峠","表形式","北緯36度45分58秒東経138度49分21秒","新潟県南魚沼郡湯沢町・群馬県利根郡みなかみ町三国峠-地理院地図三国峠-Google マップ","","国道17号（三国トンネル）三国街道","三国山脈","","","","","","","","","","","","","","",""
"暮坂峠","[22暮坂峠くれさか群馬県吾妻郡中之条町] 暮坂峠 （くれさかとうげ）は 群馬県 吾妻郡 中之条町 にある 峠 。","https://ja.wikipedia.org/wiki/暮坂峠","日本百名峠","https://ja.wikipedia.org/wiki/日本百名峠","表形式","北緯36度36分8秒東経138度41分3秒","群馬県吾妻郡中之条町","1088m","群馬県道55号中之条草津線","","","","","","","","","","","","","","","",""
"十石峠","[23十石峠じっこく群馬県多野郡上野村・長野県南佐久郡佐久穂町] 十石峠 （じっこくとうげ）  は、 長野県 南佐久郡 佐久穂町 と 群馬県 多野郡 上野村 の間にある 峠 。","https://ja.wikipedia.org/wiki/十石峠","日本百名峠","https://ja.wikipedia.org/wiki/日本百名峠","表形式","北緯36度6分22秒東経138度38分50秒","群馬県多野郡上野村・長野県南佐久郡佐久穂町","1,351m","国道299号国道462号","関東山地","","","","","","","","","","","","","","",""
"十文字峠","[24十文字峠じゅうもんじ埼玉県秩父市・長野県南佐久郡川上村] 十文字峠 （じゅうもんじとうげ）とは、 長野県 南佐久郡 川上村 と 埼玉県 秩父市 の境、 奥秩父 にある 峠 。標高1,962m。","https://ja.wikipedia.org/wiki/十文字峠","日本百名峠","https://ja.wikipedia.org/wiki/日本百名峠","表形式","北緯35度56分34秒東経138度44分05秒","日本埼玉県秩父市長野県南佐久郡川上村","1,962m","","奥秩父山塊","","","","","","","","","","","","","","",""
"雁坂峠","[25雁坂峠かりさか埼玉県秩父市・山梨県山梨市] 雁坂峠 （かりさかとうげ）は 埼玉県 秩父市 と 山梨県 山梨市 の境にある 峠 。 標高 2,082m。 奥秩父 の山域の主脈の一つであり 針ノ木峠 、 三伏峠 と並び、「日本三大峠」に数えられる。","https://ja.wikipedia.org/wiki/雁坂峠","日本百名峠","https://ja.wikipedia.org/wiki/日本百名峠","表形式","北緯35度53分34秒東経138度47分24秒","埼玉県秩父市・山梨県山梨市","2,082m","国道140号（秩父往還）（雁坂トンネル）","奥秩父山塊","","","","","","","","","","","","","","",""
"妻坂峠 (存在しないページ)","[26妻坂峠つまさか埼玉県飯能市・秩父郡横瀬町]","https://ja.wikipedia.org/w/index.php?title=妻坂峠&amp;action=edit&amp;redlink=1","日本百名峠","https://ja.wikipedia.org/wiki/日本百名峠","表形式","","","","","","","","","","","","","","","","","","","",""
"境ノ明神峠 (存在しないページ)","[27境ノ明神峠さかいのみょうじん茨城県久慈郡大子町・栃木県那須郡那珂川町]","https://ja.wikipedia.org/w/index.php?title=境ノ明神峠&amp;action=edit&amp;redlink=1","日本百名峠","https://ja.wikipedia.org/wiki/日本百名峠","表形式","","","","","","","","","","","","","","","","","","","",""
"横根峠 (存在しないページ)","[28横根峠よこね千葉県鴨川市・富津市・安房郡鋸南町]","https://ja.wikipedia.org/w/index.php?title=横根峠&amp;action=edit&amp;redlink=1","日本百名峠","https://ja.wikipedia.org/wiki/日本百名峠","表形式","","","","","","","","","","","","","","","","","","","",""
"小仏峠","[29小仏峠こぼとけ東京都八王子市・神奈川県相模原市] 小仏峠 （こぼとけとうげ）は、 東京都 八王子市 裏高尾町 と 神奈川県 相模原市 緑区 の間にある 峠 。 多摩川 水系と 相模川 水系とを隔てる 分水界 。 標高 は548m。","https://ja.wikipedia.org/wiki/小仏峠","日本百名峠","https://ja.wikipedia.org/wiki/日本百名峠","表形式","北緯35度38分08秒東経139度13分00秒","日本東京都八王子市裏高尾町神奈川県相模原市緑区千木良","548m","","","北緯35度38分08秒東経139度13分00秒﻿ / ﻿北緯35.63556度 東経139.21667度﻿ /35.63556; 139.21667座標:北緯35度38分08秒東経139度13分00秒﻿ / ﻿北緯35.63556度 東経139.21667度﻿ /35.63556; 139.21667","","","","","","","","","","","","","",""
"御殿峠","[30御殿峠ごてん東京都八王子市・町田市] 御殿峠 （ごてんとうげ）は、 東京都 八王子市 片倉町 と 町田市 相原町 の境に位置する 国道16号 の 峠 である。 標高 183mは国道16号線の最高点。 御殿峠の周囲が杉山だった時期もあったことから杉山峠ともいう  。 御殿山 の麓に位置し、新道、旧道、古道が存在する。御殿山の東稜を切り開いて開通した新道は自動車交通の要衝である一方、古道は数少ない 鎌倉街道 の跡でもある。 日本閣 の私有地となり入れない場所もある。","https://ja.wikipedia.org/wiki/御殿峠","日本百名峠","https://ja.wikipedia.org/wiki/日本百名峠","表形式","北緯35度37分16秒東経139度20分28秒","八王子市宇津貫町","183mm","国道16号鎌倉街道大山道","","","","","","","","","","","","","","","",""
"足柄峠","[31足柄峠あしがら神奈川県南足柄市・静岡県駿東郡小山町] 足柄峠 （あしがらとうげ）は 静岡県 駿東郡 小山町 と 神奈川県 南足柄市 の間にある 峠 。 箱根外輪山 から北に伸びた 尾根 上に位置し、 箱根峠 とともに 東海道 を構成する。 標高 759m  。","https://ja.wikipedia.org/wiki/足柄峠","日本百名峠","https://ja.wikipedia.org/wiki/日本百名峠","表形式","北緯35度19分10秒東経139度0分43秒","静岡県駿東郡小山町・神奈川県南足柄市","759m","静岡県道・神奈川県道78号御殿場大井線","箱根外輪山","","","","","","","","","","","","","","",""
"長尾峠 (神奈川県・静岡県)","[32長尾峠ながお神奈川県足柄下郡箱根町・静岡県御殿場市] 長尾峠 （ながおとうげ）は 神奈川県 足柄下郡 箱根町 と 静岡県 御殿場市 の間にある 峠 。 箱根外輪山 にある。 標高 911m。","https://ja.wikipedia.org/wiki/長尾峠_(神奈川県・静岡県)","日本百名峠","https://ja.wikipedia.org/wiki/日本百名峠","表形式","北緯35度15分31秒東経138度58分30秒","神奈川県足柄下郡箱根町・静岡県御殿場市","911m","静岡県道401号・神奈川県道736号御殿場箱根線（長尾トンネル）","箱根外輪山","","","","","","","","","","","","","","",""
"大菩薩峠","[33大菩薩峠だいぼさつ山梨県甲州市・北都留郡小菅村] 大菩薩峠 （だいぼさつとうげ）は、 山梨県 甲州市 塩山上萩原と 北都留郡 小菅村 鞍部の境にある 峠 。 標高 1,897 m  。 大菩薩嶺 （標高2,057m）の南方約2kmに位置する尾根の鞍部である   。","https://ja.wikipedia.org/wiki/大菩薩峠","日本百名峠","https://ja.wikipedia.org/wiki/日本百名峠","表形式","北緯35度44分9秒東経138度51分12秒","山梨県甲州市・北都留郡小菅村","1,897m","","大菩薩連嶺・奥秩父山塊","","","","","","","","","","","","","","",""
"御坂峠","[34御坂峠みさか山梨県笛吹市・南都留郡富士河口湖町] 御坂峠 （みさかとうげ）は、 山梨県 南都留郡 富士河口湖町 と同県 笛吹市 御坂町にまたがる 峠 。鎌倉往還御坂路のルート上にある。御坂の名は 日本武尊 が東国遠征の際に越えたことに由来するとされる。","https://ja.wikipedia.org/wiki/御坂峠","日本百名峠","https://ja.wikipedia.org/wiki/日本百名峠","表形式","北緯35度33分23秒東経138度45分49秒","山梨県南都留郡富士河口湖町・笛吹市","1520m","国道137号（新御坂トンネル）山梨県道708号富士河口湖笛吹線（御坂隧道）","御坂山地","","","","","","","","","","","","","","",""
"鳥井峠","[35鳥井峠とりい新潟県東蒲原郡阿賀町・福島県耶麻郡西会津町] 鳥井峠 （とりいとうげ）は 新潟県 東蒲原郡 阿賀町 と 福島県 耶麻郡 西会津町 の境界にある峠である。標高199メートル。","https://ja.wikipedia.org/wiki/鳥井峠","日本百名峠","https://ja.wikipedia.org/wiki/日本百名峠","表形式","北緯37度39分38秒東経139度34分39秒","日本福島県耶麻郡西会津町新潟県東蒲原郡阿賀町","199m","国道49号","越後山脈","","","","","","","","","","","","","","",""
"倶利伽羅峠","[36倶利伽羅峠くりから富山県小矢部市・石川県河北郡津幡町] 倶利伽羅峠 （くりからとうげ）は、 富山県 と 石川県 の境にある 砺波山 の 峠 である。倶 梨 伽羅峠と表記することもある。","https://ja.wikipedia.org/wiki/倶利伽羅峠","日本百名峠","https://ja.wikipedia.org/wiki/日本百名峠","表形式","","日本石川県河北郡津幡町富山県小矢部市","277m","国道8号くりからバイパス（倶利伽羅トンネル）石川県道・富山県道286号刈安安楽寺線北陸新幹線（新倶利伽羅トンネル）あいの風とやま鉄道線（倶利伽羅トンネル）","砺波山","","","","","","","","","","","","","","",""
"朴峠 (存在しないページ)","[37朴峠ほお富山県南砺市]","https://ja.wikipedia.org/w/index.php?title=朴峠&amp;action=edit&amp;redlink=1","日本百名峠","https://ja.wikipedia.org/wiki/日本百名峠","表形式","","","","","","","","","","","","","","","","","","","",""
"谷峠","[38谷峠たに石川県白山市・福井県勝山市] 谷峠 （たにとうげ）は、 石川県 白山市 白峰 と 福井県 勝山市 北谷町の境界にある 峠 。最高地点の 標高 は910m。","https://ja.wikipedia.org/wiki/谷峠","日本百名峠","https://ja.wikipedia.org/wiki/日本百名峠","表形式","北緯36度08分00.4秒東経136度35分13.0秒","日本石川県白山市福井県勝山市","910m","国道157号","","","","","","","","","","","","","","","",""
"木の芽峠","[39木の芽峠きのめ福井県南条郡南越前町・敦賀市] 木ノ芽峠 （きのめとうげ）は、 福井県 の 嶺北 （越前地方）と 嶺南 （若狭地方）を隔てる 峠 である。 木嶺 （もくれい）とも言い、「嶺北」「嶺南」の語源となっている。","https://ja.wikipedia.org/wiki/木の芽峠","日本百名峠","https://ja.wikipedia.org/wiki/日本百名峠","表形式","北緯35度43分1秒東経136度8分26秒","福井県南条郡南越前町・敦賀市","628m","国道476号（木ノ芽峠トンネル）北陸自動車道（敦賀トンネル）北陸本線（北陸トンネル）","","","","","","","","","","","","","","","",""
"野麦峠","[40野麦峠のむぎ岐阜県高山市・長野県松本市] 野麦峠 （のむぎとうげ）は、 岐阜県 高山市 と 長野県 松本市 の県境に位置し、 飛騨国 と 信濃国 を結ぶ鎌倉街道・江戸街道と呼ばれる街道の 峠 。 乗鞍岳 と 鎌ヶ峰 の間にあり、標高1,672 m。 長野県道・岐阜県道39号奈川野麦高根線 が通っている。","https://ja.wikipedia.org/wiki/野麦峠","日本百名峠","https://ja.wikipedia.org/wiki/日本百名峠","表形式","北緯36度3分7秒東経137度36分19秒","岐阜県高山市・長野県松本市","1,672m","長野県道・岐阜県道39号奈川野麦高根線","飛騨山脈","","","","","","","","","","","","","","",""
"大門峠","[41大門峠だいもん長野県茅野市・小県郡長和町] 大門峠 （だいもんとうげ）は、 長野県 茅野市 と同県 小県郡 長和町 の境にある 峠 。 国道152号 が通過している。","https://ja.wikipedia.org/wiki/大門峠","日本百名峠","https://ja.wikipedia.org/wiki/日本百名峠","表形式","北緯36度6分36.6秒東経138度14分3.8秒","長野県茅野市・小県郡長和町","1,441m","国道152号","八ヶ岳連峰・霧ヶ峰","","","","","","","","","","","","","","",""
"関田峠 (存在しないページ)","[42関田峠せきた長野県飯山市・新潟県上越市]","https://ja.wikipedia.org/w/index.php?title=関田峠&amp;action=edit&amp;redlink=1","日本百名峠","https://ja.wikipedia.org/wiki/日本百名峠","表形式","","","","","","","","","","","","","","","","","","","",""
